47,1;47*;;;;"Le sapin domine, accompagné de nombreux mélèzes, sorbiers des oiseleurs, aulnes verts ainsi que de quelques épicéas ; par endroits : hêtres et érables sycomores chétifs. Degré de fermeture clairiéré. Arbres isolés à longs houppiers, rarement troches de quelques arbres.";20;30;32;20;;"Subalpin und hochmontan Hauptwaldstandort, unter- & obermontan Sonderwaldstandort. Saure Unterlage, häufig an kalten Nordhängen oder im Bereich von kältespeichernden Blockhalden, auch an ost- und westexponierten Hängen
";"Station forestière principale des étages subalpin et haut-montagnard et station forestière particulière de l'étage montagnard inférieur et supérieur. Substrat acide ; souvent sur versants nord froids ou à proximité d’éboulis de gros blocs emmagasinant le froid, aussi sur pentes exposées à l’est et à l’ouest. ";"Üppig, strauchreich, viele Moose. Alpenrosengebüsch mit Reitgrasrasen, Heidelbeeren
";Luxuriant, riche en buissons, mousses abondantes. Buissons de rhododendrons avec pelouses de calamagrostides, myrtilles. ;Rohhumus, stellenweise Moder;"Humuspodsol, Braunerde, stellenweise Podsol, podsolierte Braunerde, Pararendzina, Regosol, Ranker, Gesteinsrohboden, in Taschen podsoliert
";"Skelettreich (Blöcke), Gründigkeit mittel, Durchlässigkeit normal bis übermässig
";Forte pierrosité (blocs), profondeur moyenne, perméabilité normale à extrême. ;0;0;;;;1;0;1;1;2;2;2;1;1;1;1;0;0;1;1;2;0;0;0;0;0;0;47Stern;;;;;;;;;;2;HoehStuf HM oder SA;2;HoehStuf OM/UM;0;;0;0;2;0
47,1000001;47*LÜ;47*;U;"Tanne dominiert, dazu viel Lärche, Vogelbeere, Grünerle. Der Schlussgrad ist aufgelöst.
Einzelbäume mit langen Kronen, selten Rotten mit wenig Bäumen.
";Le sapin domine, accompagné de nombreux mélèzes, sorbiers des oiseleurs et aulnes verts. Degré de fermeture clairiéré. Arbres isolés à longs houppiers, rarement troches de quelques arbres. ;20;30;32;20;;"Subalpin und hochmontan Hauptwaldstandort, unter- & obermontan Sonderwaldstandort. Saure Unterlage, häufig an kalten Nordhängen oder im Bereich von kältespeichernden Blockhalden, auch an ost- und westexponierten Hängen
";"Station forestière principale des étages subalpin et haut-montagnard, station forestière particulière de l'étage montagnard inférieur et supérieur. Substrat acide ; souvent sur versants nord froids ou à proximité d’éboulis de gros blocs emmagasinant le froid, aussi sur pentes exposées à l’est et à l’ouest. ";"Üppig, strauchreich, viele Moose. Alpenrosengebüsch mit Reitgrasrasen, Heidelbeeren
";Luxuriant, riche en buissons, mousses abondantes. Buissons de rhododendrons avec pelouses de calamagrostides, myrtilles. ;;;;;0;0;;;;1;0;1;1;2;2;2;1;1;1;1;0;0;1;1;1;0;0;0;0;0;0;47SternLa;N;;Y;Y;N;;Y;Y;Y;2;HoehStuf HM oder SA;2;HoehStuf OM/UM;0;;0;0;2;0
48;48;;H;"Fichte und Tanne dominieren, dazu Vogelbeere, stellenweise Bergahorn, in unteren Lagen auch Buchen im Nebenbestand. Wenn das Kleinstandortsmosaik stark ausgeprägt ist, ist die Konkurrenz zwischen den Baumkronen gering. Der Schlussgrad ist locker bis räumig. Einzelbäume, Kleinkollektive und Rottenansätze. Stufige Bestände sind häufig. Die Fichte wächst eher auf Blöcken, die Tanne hingegen auch dazwischen.
";L’épicéa et le sapin dominent, accompagnés du sorbier des oiseleurs et, par endroits, de l’érable sycomore. Dans les stations inférieures, hêtre en peuplement accessoire. Lorsque la mosaïque de petites stations est très marquée, la concurrence entre les houppiers est minime. Le degré de fermeture est entrouvert à espacé. Arbres isolés et petits collectifs. Petites troches. Les peuplements sont fréquemment étagés. L’épicéa croît plutôt sur les blocs, le sapin aussi entre-deux. ;25;35;38;25;;"Sonderwaldstandort. Ruhender basischer Blockschutt oder Karren, oft Ablagerungsgebiet eines Bergsturzes, stark ausgeprägtes Kleinrelief.
";Station forestière particulière. Éboulis de gros blocs basiques en cours de stabilisation ou lapiés, souvent zone de dépôt d’un éboulement, microrelief très accentué.  ;"Sehr artenreich. Auf Steinen: Moosteppich mit Heidelbeere, schwarze Heckenkirsche (Lonicera nigra) und Farnen. In Mulden: üppig, artenreich, mit Hochstauden
";Très riche en espèces. Sur les pierres : tapis de mousses avec myrtille, chèvrefeuille noir (Lonicera nigra) et fougères. Dans les cuvettes : luxuriant avec des mégaphorbiées. ;Rohhumus, stellenweise Tangelhumus, Moder;"Gesteinsrohboden, stellenweise Ranker, Regosol, Pararendzina, Rendzina, in Spalten organische Böden
";"Skelettgehalt sehr bis äusserst hoch, Gründgkeit flach bis tief, durchlässig, keine Vernässung
";Pierrosité élevée à extrêmement élevée, sol superficiel à profond, perméable, non hydromorphe. ;0;9;9;0;;2;1;2;1;0;2;0;2;2;2;1;0;0;1;2;2;0;0;0;0;0;0;48;;;;;;;;;;0;;1;;0;;0;0;0;0
49;49;;H;"Tanne und Fichte dominieren, dazu Vogelbeere, in Mulden besonders in basenreicheren Ausbildungen im Nebenbestand auch Bergahorn, Weisserle, stellenweise Esche. Die vernässten Mulden sind zum grossen Teil nadelwaldfeindlich. Wenn die versauerten Kuppen nicht zu gross sind, so ist der Schlussgrad räumig bis aufgelöst. Neben Kleinkollektiven und Einzelbäumen sind auch Rotten vorhanden
";Le sapin et l’épicéa dominent, accompagnés du sorbier des oiseleurs. Dans les cuvettes, surtout plus basiques, on trouve aussi l’érable sycomore, l’aulne blanc et, par endroits, le frêne. Les cuvettes engorgées sont le plus souvent hostiles aux résineux. Lorsque les éminences acidifiées ne sont pas très grandes, le degré de fermeture est espacé à clairiéré. Quelques troches avoisinent de petits collectifs et des arbres isolés. ;20;30;32;25;;"Auf dichter Unterlage, im Bereich von quelligen Aufstössen oder leicht fliessendem Wasser in Mulden.
";Sur substrat cohérent, à proximité de sources ou d’eaux courantes à faible écoulement dans les cuvettes. ;"In Mulden: üppig, artenreich, Waldschachtelhalm, Sumpfdotterblume. Auf Kuppen: Heidelbeere, viele säurezeigende Moose
"; Dans les cuvettes : luxuriant, riche en espèces, prêle des bois, populage. Sur les éminences : myrtille et mousses indicatrices d’acidité abondantes.  ;Im Mulden Mull, feuchte Ausprägung, Anmoor, Torf, auf Kuppen Moder, Rohhumus;"In Mulden Nassböden beeinflusst durch Hang-/Grund- oder Stauwasser, auf Kuppen vernässte Braunerde
";"Skelettgehalt gering bis hoch, Gründigkeit tief bis sehr tief, Durchlässigkeit auf Kuppen mittel bis gering, in Mulden sehr gering, sumpfig bis grundnass, Pseudogley bis pseudovergleyt
";Pierrosité faible à élevée, sol profond à très profond, perméabilité moyenne à faible sur les élévations de terrain à faible dans les cuvettes, tourbeux à influencé par la nappe phréatique, pseudogley à pseudogleyifié. ;0;9;1;50;;1;2;2;1;0;2;0;0;0;0;0;0;0;0;0;0;1;1;0;1;2;1;49;;;;;;;;;;1;;0;;0;;0;0;0;0
49,1;49*;;H;"Fichte dominiert, dazu Grünerle und Vogelbeere. Die vernässten Mulden sind äusserst nadelbaumfeindlich. Schlussgrad räumig bis aufgelöst. Rottenstruktur. Reduzierte Wüchsigkeit wegen stark wechselnder Feuchtigkeit, die Fichte hat oft gelbe Nadeln.
";L’épicéa domine, accompagné de l’aulne vert et du sorbier des oiseleurs. Les cuvettes engorgées sont très hostiles aux résineux. Degré de fermeture espacé à clairiéré. Structure par troches. Croissance réduite par suite des fortes variations d’humidité. Les épicéas ont souvent des aiguilles jaunes. ;10;25;27;20;;"Vor allem auf tonhaltigen Schichten von karbonathaltigen Schiefern, auch Flysch. Oft grossräumige Rutschhänge, die von zahlreichen Quellaufstössen
und kleinen Bachläufen durchsetzt sind. Häufig starke Schwankungen zwischen sehr nass und trocken.
";Surtout sur couches argileuses de schistes carbonatés ou de flysch. Souvent glissements étendus parsemés de nombreuses sources et de petits ruisseaux. Alternance fréquente de périodes très humides et de périodes sèches. ;"In Mulden artenreiche krautige Vegetation mit vielen Sumpfpflanzen. Auf Kuppen Heidelbeere und säurezeigende Moose
";Végétation herbacée riche en espèces et en plantes des marais dans les cuvettes. Myrtille et mousses indicatrices d’acidité sur les éminences. ;In Mulden Anmoor, auf Kuppen Rohhumus, teils erodiert;"Nassböden beeinflusst durch Hang-/Grundwasser oder Stauwasser, vernässter Regosol oder Pararendzina, teils verbraunt
";"Skelettanteil gering bis hoch, Gründigkeit sehr tief bis mittel, Durchlässigkeitmittel bis sehr gering, sumpfig bis grundnass, Pseudogley bis pseudovergleyt
";Pierrosité faible à élevée, sol très profond à moyen, perméabilité moyenne à très faible, tourbeux à influencé par la nappe phréatique, pseudogley à peu pseudogleyifié. ;9;1;1;50;;0;1;2;1;0;2;0;0;0;0;0;0;0;0;0;0;1;1;0;1;1;1;49Stern;;;;;;;;;;1;;0;;0;;0;0;0;0
49,1000002;49*Ta;49*;U;"Fichte dominiert, mindestens einzelne Tannen können die Oberschicht erreichen, dazu Bergahorn, Grünerle und Vogelbeere. Die vernässten Mulden sind äusserst nadelbaumfeindlich. Schlussgrad räumig bis aufgelöst. Rottenstruktur. Reduzierte Wüchsigkeit wegen stark wechselnder Feuchtigkeit, die Fichte hat oft gelbe Nadeln.
";L’épicéa domine, au moins quelques sapins peuvent atteindre la strate supérieure. En plus : érable sycomore, aulne vert et sorbier des oiseleurs. Les cuvettes engorgées sont très hostiles aux résineux. Degré de fermeture espacé à clairiéré. Structure par troches. Croissance réduite par suite des fortes variations d’humidité. Les épicéas ont souvent des aiguilles jaunes. ;10;25;27;20;;"Vor allem auf tonhaltigen Schichten von karbonathaltigen Schiefern, auch Flysch. Oft grossräumige Rutschhänge, die von zahlreichen Quellaufstössen
und kleinen Bachläufen durchsetzt sind. Häufig starke Schwankungen zwischen sehr nass und trocken.
";Surtout sur couches argileuses de schistes carbonatés ou de flysch. Souvent glissements étendus parsemés de nombreuses sources et de petits ruisseaux. Alternance fréquente de périodes très humides et de périodes sèches. ;"In Mulden artenreiche krautige Vegetation mit vielen Sumpfpflanzen. Auf Kuppen Heidelbeere und säurezeigende Moose
";Végétation herbacée riche en espèces et en plantes des marais dans les cuvettes. Myrtille et mousses indicatrices d’acidité sur les éminences. ;;;;;9;1;1;50;;0;1;2;1;0;2;0;0;0;0;0;0;0;0;0;0;1;1;0;1;1;1;49SternTa;;;Y;Y;Y;;Y;Y;Y;1;;0;;0;;0;0;0;0
50;50;;H;Tanne und Fichte dominieren, dazu Vogelbeere, in basischen Ausbildungen etwas Bergahorn. Unterhalb von 1200 m über Meer auch Esche. Schlussgrad normal bis locker. Einzelbäume und Kleinkollektive;Le sapin et l’épicéa dominent, accompagnés du sorbier des oiseleurs et de quelques érables sycomores dans les formations basiques. En dessous de 1200 m d’altitude, présence également du frêne. Degré de fermeture normal à entrouvert. Arbres isolés et petits collectifs.;30;40;45;25;;"Vor allem auf rasch verwitterndem, siltig-tonigem Ausgangsgestein, meistens Schattenhänge, häufig etwas wasserzügige Mulden.
";Surtout sur roche-mère argileuse limoneuse en rapide altération. En général pentes ombragées, souvent cuvettes alimentées en eau courante. ;"In Lücken üppige Hochstauden wie Grauer Alpendost, Alpenmilchlattich. An erhöhten Stellen: Heidelbeere, Alpenlattich, säurezeigende Moose
";Mégaphorbiées luxuriantes dans les trouées : adénostyle à feuilles d’alliaire, cicerbite (laitue) des Alpes. Sur les bosses : myrtille, homogyne des Alpes et mousses indicatrices d’acidité. ;In Mulden Mull, Moder. Auf Kuppen Rohhumus, Moder;"Braunerde, stellenweise Parabraunerde, Pararendzina, Regosol, alle auch vernässt möglich
";"Skelettgehalt gering bis sehr hoch, Gründigkeit mittel bis sehr tief, Durchlässigkeit hoch bis gering, keine Vernässung bis schwach pseudovergleyt.
";Pierrosité faible à très élevée, sol moyen à très profond, perméabilité élevée à faible, non hydromorphe à peu pseudogelyifié. ;0;0;9;42;;1;2;1;1;0;2;2;2;0;2;2;0;0;2;2;1;1;1;0;2;0;0;50;;;;;;;;;;1;;0;;0;;0;0;0;0
50,0000003;50Re;50;U;Fichte dominiert, dazu Vogelbeere, in basischen Ausbildungen etwas Bergahorn, Unterhalb von 1200 m über Meer auch Esche. Schlussgrad normal bis locker. Einzelbäume und Kleinkollektive;L’épicéa domine, accompagné du sorbier des oiseleurs et de quelques érables sycomores dans les formations basiques. En dessous de 1200 m d’altitude, présence également du frêne. Degré de fermeture normal à entrouvert. Arbres isolés et petits collectifs.;30;40;45;25;;"Vor allem auf rasch verwitterndem, siltig-tonigem Ausgangsgestein, meistens Schattenhänge, häufig etwas wasserzügige Mulden.
";Surtout sur roche-mère argileuse limoneuse en rapide altération. En général pentes ombragées, souvent cuvettes alimentées en eau courante. ;"In Lücken üppige Hochstauden wie Grauer Alpendost, Alpenmilchlattich. An erhöhten Stellen: Heidelbeere, Alpenlattich, säurezeigende Moose
";Mégaphorbiées luxuriantes dans les trouées : adénostyle à feuilles d’alliaire, cicerbite (laitue) des Alpes. Sur les bosses : myrtille, homogyne des Alpes et mousses indicatrices d’acidité. ;;;;;0;0;9;42;;1;2;1;1;0;2;2;2;0;2;2;0;0;2;2;1;1;1;0;2;0;0;50Re;;Y;Y;Y;Y;;Y;Y;Y;1;;0;;0;;0;0;0;0
50,000003;50Fe;50;U;Tanne und Fichte dominieren, dazu Vogelbeere, in basischen Ausbildungen etwas Bergahorn. Unterhalb von 1200 m über Meer auch Esche. Schlussgrad normal bis locker. Einzelbäume und Kleinkollektive;Le sapin et l’épicéa dominent, accompagnés du sorbier des oiseleurs et de quelques érables sycomores dans les formations basiques. En dessous de 1200 m d’altitude, présence également du frêne. Degré de fermeture normal à entrouvert. Arbres isolés et petits collectifs.;30;40;45;25;;"Vor allem auf rasch verwitterndem, siltig-tonigem Ausgangsgestein, meistens Schattenhänge, häufig etwas wasserzügige Mulden, mit anstehendem Fels.
";Surtout sur roche-mère argileuse limoneuse en rapide altération. En général pentes ombragées, souvent cuvettes alimentées en eau courante, avec roches affleurantes. ;"In Lücken üppige Hochstauden wie Grauer Alpendost, Alpenmilchlattich. An erhöhten Stellen: Heidelbeere, Alpenlattich, säurezeigende Moose
";Mégaphorbiées luxuriantes dans les trouées : adénostyle à feuilles d’alliaire, cicerbite (laitue) des Alpes. Sur les bosses : myrtille, homogyne des Alpes et mousses indicatrices d’acidité. ;;;;;0;0;9;42;;1;2;1;1;0;2;2;1;0;2;2;0;0;2;2;1;1;1;0;2;0;0;50Fe;Y;Y;N;Y;N;Y;Y;Y;Y;1;;0;;0;;0;0;1;0
50,00008;50P;50;U;Fichte und Tanne dominieren, häufig sind auch tannenarme Pionierphasen, dazu Grünerle, Weisserle, Bergahorn, Vogelbeere, unterhalb von 1200 m über Meer auch Esche. Schlussgrad normal bis aufgelöst. Einzelbäume und Kleinkollektive, oft vertikale Lücken;L’épicéa et le sapin dominent, ce dernier étant souvent peu abondant durant les phases pionnières. Ils sont accompagnés de l’aulne vert, de l’aulne blanc, de l’érable sycomore et du sorbier des oiseleurs. En dessous de 1200 m d’altitude, présence également du frêne. Degré de fermeture normal à clairiéré. Arbres isolés et petits collectifs, souvent trouées verticales.;30;40;45;25;;"Kühle, mässig luftfeuchte Muldenlagen mit bewegtem Boden sowie steile Tobelflanken mit oberflächlicher Erosion. Kleinere Rutschungen und Lawinenzüge sind typisch. Gutverwitterndes, höchstens mässig basenreiches Gestein.
";Cuvettes avec air modérément humide, sol en mouvement et versants de ravins à érosion superficielle. Les petits glissements et couloirs d’avalanche sont caractéristiques. Roche s’altérant facilement, de basicité tout au plus modérée. ;"In Bestandeslücken und Mulden: üppige Staudenflur, in der die Weisse Pestwurz dominiert. An erhöhten Stellen: Heidelbeere, säurezeigende Moose
";Dans les trouées des peuplements et les cuvettes : hautes herbes luxuriantes dominées par le pétasite blanc. Sur les bosses : myrtille, mousses indicatrices d’acidité. ;Mull, teils erodiert, auf Kuppen auch Moder, Rohhumus;"Regosol, stellenweise Pararendzina, Rendzina, Braunerde, alle auch vernässt möglich.
";"Skelettgehalt mittel bis sehr hoch, Gründigkeit tief bis sehr tief, Durchlässigkeit mittel bis gering, keine Vernässung bis grundnass.
";Pierrosité moyenne à très élevée, sol profond à très profond, perméabilité moyenne à faible, non hydromorphe à influencé par la nappe phréatique.  ;0;0;1;50;;1;2;2;1;0;0;1;2;0;2;0;2;0;0;1;1;1;1;0;2;2;0;50P;;;;;;;;;;1;;0;;0;;0;0;0;0
50,1;50*;50;U;"Tanne und Fichte dominieren, dazu Bergahorn, Vogelbeere, unterhalb von 1200 m über Meer auch Esche.
Schlussgrad normal bis locker, Einzelbäume und Kleinkollektive";"Le sapin et l’épicéa dominent, accompagnés de l’érable sycomore et du sorbier des oiseleurs. En dessous de 1200 m d’altitude, présence également du frêne. Degré de fermeture normal à entrouvert ; arbres isolés et petits collectifs.";30;40;45;25;;"Auf kalkreicher, meist verwitterter, mässig toniger Unterlage (z. B. Bündnerschiefer), oft leichte Oberflächenerosion, Steilhänge, eher Schattenlage
";Sur substrat riche en calcaire assez argileux, généralement altéré, p.ex. schistes lustrés (Bündnerschiefer). Souvent légère érosion de surface, pentes raides, plutôt ombragées. ;"Durchgehende, nicht üppige Krautschicht mit Kahlem Alpendost, Weisser Pestwurz, säurezeigende Moose mit mässiger Deckung, viel Schönschnabelmoos (Eurhynchium striatum)
";"Strate herbacée continue, peu luxuriante : adénostyle glabre, pétasite blanc ; mousses indicatrices d’acidité assez abondantes, nombreuses eurhynchies striées (Eurhynchium striatum). ";Mull, stellenweise Moder, Kalkmull, teils erodiert;"Rendzina, Regosol, stellenweise Pararendzina, neutrale Braunerde, Braunerde
";"Skelettgehalt mittel bis sehr hoch, Gründigkeit mittel bis sehr tief, durchlässig, keine Vernässung.
";Pierrosité moyenne à très forte, sol moyennement profond à très profond, perméable, non hydromorphe. ;9;1;1;45;;0;1;2;2;2;2;1;2;0;2;2;2;0;2;1;1;2;1;0;0;0;0;50Stern;;;;;;;;;;1;;0;;0;;0;0;0;0
50,1000003;50*Re;50*;U;"Fichte dominiert, dazu Bergahorn, Vogelbeere, unterhalb von 1200 m über Meer auch Esche.
Schlussgrad normal bis locker, Einzelbäume und Kleinkollektive";"L’épicéa domine, accompagné de l’érable sycomore et du sorbier des oiseleurs. En dessous de 1200 m d’altitude, présence également du frêne. Degré de fermeture normal à entrouvert ; arbres isolés et petits collectifs.";30;40;45;25;;"Auf kalkreicher, meist verwitterter, mässig toniger Unterlage (z. B. Bündnerschiefer), oft leichte Oberflächenerosion, Steilhänge, eher Schattenlage
";Sur substrat riche en calcaire assez argileux, généralement altéré, p.ex. schistes lustrés (Bündnerschiefer). Souvent légère érosion de surface, pentes raides, plutôt ombragées. ;"Durchgehende, nicht üppige Krautschicht mit Kahlem Alpendost, Weisser Pestwurz, säurezeigende Moose mit mässiger Deckung, viel Schönschnabelmoos (Eurhynchium striatum)
";"Strate herbacée continue, peu luxuriante : adénostyle glabre, pétasite blanc ; mousses indicatrices d’acidité assez abondantes, nombreuses eurhynchies striées (Eurhynchium striatum). ";;;;;9;1;1;45;;0;1;2;2;2;2;1;2;0;2;2;2;0;2;1;1;2;1;0;0;0;0;50SternRe;;Y;Y;Y;Y;;Y;Y;Y;1;;0;;0;;0;0;0;0
51;51;;H;Tanne und Fichte dominieren, dazu Bergahorn und Vogelbeere, unterhalb von 1200 m über Meer auch Esche. In den Regionen 1 und 2a selten im Nebenbestand einzelne Buchen. Schlussgrad normal bis locker, Einzelbäume und Kleinkollektive;"Le sapin et l’épicéa dominent, accompagnés de l’érable sycomore et du sorbier des oiseleurs. En dessous de 1200 m d’altitude, présence également du frêne. Rarement quelques hêtres en peuplement accessoire dans les régions 1 et 2a. Degré de fermeture normal à entrouvert ; arbres isolés et petits collectifs.";30;40;45;25;;"Gut verwitternder Untergrund, mässig tonig, siltreich, ohne Basen im Oberboden. Mässig geneigte Hänge, eher Schattenlagen
";"Substrat s’altérant facilement ; assez argileux, riche en limon ; pas de bases dans la partie superficielle du sol. Pentes modérées, plutôt ombragées.  ";"Durchgehende, artenreiche aber nicht üppige Krautschicht mit einzelnen Farnen, wenig Moose, Rundblättriges Labkraut, Hasenlattich, Waldhabichtskraut, Heidelbeere mit geringer Wüchsigkeit, Waldwachtelweizen
";Strate herbacée continue, riche en espèces mais pas luxuriante, avec quelques fougères. Peu de mousses. Gaillet à feuilles rondes, prénanthe pourpre, épervière des murs, myrtille peu développée, mélampyre des forêts. ;Moder, stellenweise Mull;"Braunerde, stellenweise Parabraunerde
";"Skelettgehalt hoch, Gründigkeit tief bis sehr tief, Durchlässigkeit hoch bis gering, schwach pseudovergleyt bis keine Vernässung
";Pierrosité élevée, sol profond à très profond, perméabilité élevée à faible, peu pseudogelyifié à non hydromorphe. ;0;0;9;45;;1;2;1;2;2;2;2;2;0;2;2;0;0;2;2;2;2;2;0;0;0;0;51;;;;;;;;;;1;;0;;0;;0;0;0;0
51,0000003;51Re;51;U;Fichte dominiert, dazu Bergahorn und Vogelbeere, unterhalb von 1200 m über Meer auch Esche. Schlussgrad normal bis locker, Einzelbäume und Kleinkollektive;"L’épicéa domine, accompagné de l’érable sycomore et du sorbier des oiseleurs. En dessous de 1200 m d’altitude, présence également du frêne. Degré de fermeture normal à entrouvert ; arbres isolés et petits collectifs.";30;40;45;25;;"Gut verwitternder Untergrund, mässig tonig, siltreich, ohne Basen im Oberboden. Mässig geneigte Hänge, eher Schattenlagen
";"Substrat s’altérant facilement ; assez argileux, riche en limon ; pas de bases dans la partie superficielle du sol. Pentes modérées, plutôt ombragées. ";"Durchgehende, artenreiche aber nicht üppige Krautschicht mit einzelnen Farnen, wenig Moose, Rundblättriges Labkraut, Hasenlattich, Waldhabichtskraut, Heidelbeere mit geringer Wüchsigkeit, Waldwachtelweizen
";Strate herbacée continue, riche en espèces mais pas luxuriante, avec quelques fougères. Peu de mousses. Gaillet à feuilles rondes, prénanthe pourpre, épervière des murs, myrtille peu développée, mélampyre des forêts. ;;;;;0;0;9;45;;1;2;1;2;2;2;2;2;0;2;2;0;0;2;2;2;2;2;0;0;0;0;51Re;;;Y;Y;Y;;Y;Y;Y;1;;0;;0;;0;0;0;0
51,000003;51Fe;51;U;Tanne und Fichte dominieren, dazu Bergahorn und Vogelbeere, unterhalb von 1200 m über Meer auch Esche. In den Regionen 1 und 2a selten im Nebenbestand einzelne Buchen. Schlussgrad normal bis locker, Einzelbäume und Kleinkollektive;Le sapin et l’épicéa dominent, accompagnés de l’érable sycomore et du sorbier des oiseleurs. En dessous de 1200 m d’altitude, présence également du frêne. Rarement quelques hêtres en peuplement accessoire dans les régions 1 et 2a. Degré de fermeture normal à entrouvert, arbres isolés et petits collectifs.;30;40;45;25;;"Gut verwitternder Untergrund, mässig tonig, siltreich, ohne Basen im Oberboden. Mässig geneigte Hänge, eher Schattenlagen, mit anstehendem Fels.
";"Substrat s’altérant facilement ; assez argileux, riche en limon ; pas de bases dans la partie superficielle du sol. Pentes modérées, plutôt ombragées, avec roches affleurantes. ";"Durchgehende, artenreiche aber nicht üppige Krautschicht mit einzelnen Farnen, wenig Moose, Rundblättriges Labkraut, Hasenlattich, Waldhabichtskraut, Heidelbeere mit geringer Wüchsigkeit, Waldwachtelweizen
";Strate herbacée continue, riche en espèces mais pas luxuriante, avec quelques fougères. Peu de mousses. Gaillet à feuilles rondes, prénanthe pourpre, épervière des murs, myrtille peu développée, mélampyre des forêts. ;;;;;0;0;9;45;;1;2;1;2;2;2;2;1;0;2;2;0;0;2;2;2;2;2;0;0;0;0;51Fe;Y;Y;N;Y;N;Y;Y;Y;Y;1;;0;;0;;0;0;1;0
51,00002;51C;;;;Le sapin domine, accompagné de l’épicéa. Dans les phases pionnières, le frêne, l’érable, l’orme de montagne et le tilleul sont également répandus, le noisetier pouvant se développer vigoureusement dans la strate buissonnante. Degré de fermeture normal à entrouvert. Surtout arbres isolés. ;30;40;45;35;;"Konsolidierte Schutthalden. Im Buchenareal wachsen auf vergleichbaren Standorten Buchen. Die Buche fehlt hier vermutlich wegen den stark wirkenden Frösten.
";Éboulis stabilisés. Dans l’aire de répartition du hêtre, celui-ci se rencontre sur des stations semblables. Il est absent ici probablement à cause des fortes gelées. ;"In Lücken kann eine üppige Staudenvegetation entstehen, im Bestand und unter den üppigen Haselstauden ist die Krautvegetation nur spärlich ausgebildet.
";Une végétation luxuriante de hautes herbes peut se former dans les trouées. La végétation herbacée ne se développe que faiblement sous le peuplement et les noisetiers. ;Mull;"Ranker, Regosol, stellenweise Braunerde.
";"Skelettgehalt mittel, tiefgründig, normal bis übermässig durchlässig
";Pierrosité moyenne, sol profond, perméabilité normale à extrême. ;0;0;;;;1;2;1;2;0;2;2;2;0;2;0;0;0;1;2;2;2;2;0;0;0;0;51C;;;;;;;;;;1;;0;;0;;0;0;0;0
