58,00006;58L;;H;"Fichte und Lärche (fehlt meistens im Vorderrheintal) dominieren, in den kontinentalen Hochalpen sind gegen die obersubalpine Stufe hin auch Arven
eingestreut. Der Schlussgrad ist räumig bis aufgelöst. Ausgeprägte Rottenstruktur.
";"L’épicéa et le mélèze (manque le plus souvent dans la vallée du Rhin antérieur) dominent ; dans les Hautes Alpes continentales à l’étage subalpin supérieur, aussi quelques aroles. Degré de fermeture espacé à clairiéré. Structure caractéristique par troches. ";20;22;24;15;;"Saure Unterlage (Silikat), in den nördlichen Zwischenalpen nur auf sehr flachgründigen Standorten, meistens auf Rippen oder Hangschultern.
Meistens Sonnenhänge, sehr häufig beweidet
";Substrat acide (siliceux). Dans les Alpes intermédiaires du Nord uniquement sur les sols très superficiels, le plus souvent sur les arêtes ou les épaulements. En général versants ensoleillés, très souvent pâturés. ;"Karg, viele vegetationsfreie Stellen mit dürrer Nadelstreu. Viel Preiselbeere, Hallers Laserkraut, Wollreitgras, nur wenig Heidelbeere mit geringer Wuchshöhe
";Pauvre. Nombreuses zones exemptes de végétation avec fane résineuse sèche. Airelle rouge, laser de Haller et calamagrostide velue abondants, myrtille basse peu abondante. ;Moder trockene Ausprägung, stellenweise Rohhumus trockene Ausprägung, teils erodiert;"Ranker, stellenweise podsolierte Braunerde, Braunpodsol
";"Skelettgehalt hoch bis äusserst hoch, Gründigkeit mittel bis tief, durchlässig, keine Vernässung
";Pierrosité élevée à extrêmement élevée, sol moyen à profond, perméable, non hydromorphe. ;0;0;1;100;;1;0;1;2;2;2;1;1;0;2;0;2;0;2;1;1;2;1;0;0;0;0;58L;;;;;;;;;;1;;0;;0;;0;0;2;0
58,0000601;58LLÜ;58L;U;"Wegen Beeinflussung durch Schneebewegungen/Lawinen dominiert die Lärche, Vogelbeere ist beigemischt, die immergrüne Fichte kommt nur spärlich vor. Der Schlussgrad ist locker bis räumig, Rottenstruktur
";En raison de l’influence des mouvements de la neige et des avalanches, le mélèze domine, en mélange avec le sorbier des oiseleurs. L’épicéa au feuillage persistant n’est présent que de manière clairsemée. Degré de fermeture entrouvert à espacé. Structure par troches. ;20;22;24;15;;"Saure Unterlage (Silikat), in den nördlichen Zwischenalpen nur auf sehr flachgründigen Standorten, meistens auf Rippen oder Hangschultern.
Meistens Sonnenhänge, sehr häufig beweidet
";Substrat acide (siliceux). Dans les Alpes intermédiaires du Nord uniquement sur les sols très superficiels, le plus souvent sur les arêtes ou les épaulements. En général, versants ensoleillés, très souvent pâturés. ;"Karg, viele vegetationsfreie Stellen mit dürrer Nadelstreu. Viel Preiselbeere, Hallers Laserkraut, Wollreitgras, nur wenig Heidelbeere mit geringer Wuchshöhe
";Pauvre. Nombreuses zones exemptes de végétation avec fane résineuse sèche. Airelle rouge, laser de Haller et calamagrostide velue abondants, myrtille basse peu abondante. ;;;;;0;0;1;100;;1;0;1;2;2;2;1;1;0;2;0;2;0;2;1;1;2;1;0;0;0;0;58LLae;;Y;Y;Y;Y;;Y;Y;Y;1;;0;;0;;0;0;2;0
59;59;;H;"Arve dominiert, dazu Lärche, Vogelbeere und Birke, stellenweise einzelne Fichten. Teilweise dominiert auch die Lärche, z. B. weil sie durch Kahlschläge oder Beweidung gefördert wurde. Der Schlussgrad ist locker bis räumig. Langkronige Einzelbäume oder Rotten mit wenig Bäumen 
";L’arole domine, accompagné du mélèze, du sorbier des oiseleurs et du bouleau. Épicéas isolés par endroits. Le mélèze domine aussi parfois, p.ex. dans les zones soumises aux effets des avalanches ou sur d’anciennes zones pâturées. Degré de fermeture entrouvert à espacé. Arbres à longs houppiers, isolés ou en troches de quelques arbres. ;15;25;28;15;;"Obersubalpin Hauptwaldstandort, subalpin Sonderwaldstandort. Meist auf Silikatgestein, selten auch auf basischem Gestein möglich. Blockig-felsige Standorte werden bevorzugt. Meistens Schattenhänge.
";Station forestière principale de l’étage subalpin supérieur, station forestière particulière de l’étage subalpin. En général sur roches siliceuses, rarement sur roches basiques. De préférence sur roches ou sur blocs. Le plus souvent versants ombragés. ;"Üppige Zwergstrauchvegetation und dichte Moosschicht
";Buissons nains vigoureux et strate muscinale dense. ;Rohhumus, stellenweise Moder;"Podsol, Braunpodsol, Ranker, Regosol, stellenweise podsolierte Braunerde, Gesteinsrohboden
";"Skelettgehalt mittel bis äusserst hoch, Gründigkeit mittel bis sehr tief, durchlässig, keine Vernässung
";Pierrosité moyenne à extrême, sol moyennement profond à très profond, perméable, non hydromorphe. ;0;0;9;110;;1;0;1;1;2;1;2;2;1;1;2;0;0;2;1;1;0;0;0;0;0;0;59;;;;;;;;;;2;HoehStuf OSA;2;HoehStuf SA;0;;0;0;0;0
59,0000001;59LÜ;59;U;"Wegen Beeinflussung durch Schneebewegungen/Lawinen dominiert die Lärche, Vogelbeere und Birke sind beigemischt, die immergrüne Arve kommt nur spärlich vor. Der Schlussgrad ist locker bis
räumig. Langkronige Einzelbäume oder Rotten mit wenig Bäumen
";En raison de l’influence des mouvements de la neige et des avalanches, le mélèze domine, en mélange avec le sorbier des oiseleurs et le bouleau. L’arole au feuillage persistant n’est présent que de manière clairsemée. Degré de fermeture entrouvert à espacé. Arbres à longs houppiers, isolés ou en troches de quelques arbres. ;15;25;28;15;;"Obersubalpin Hauptwaldstandort, subalpin Sonderwaldstandort. Meist auf Silikatgestein, selten auch auf basischem Gestein möglich. Blockig-felsige Standorte werden bevorzugt. Meistens Schattenhänge.
";Station forestière principale de l’étage subalpin supérieur, station forestière particulière de l’étage subalpin. En général sur roches siliceuses, rarement sur roches basiques. De préférence sur roches ou sur blocs. Le plus souvent versants ombragés. ;"Üppige Zwergstrauchvegetation und dichte Moosschicht
";Buissons nains vigoureux et strate muscinale dense. ;;;;;0;0;9;110;;1;0;1;1;2;1;2;2;1;1;2;0;0;2;1;1;0;0;0;0;0;0;59Lae;;Y;Y;Y;Y;;Y;Y;Y;2;HoehStuf OSA;2;HoehStuf SA;0;;0;0;0;0
59,00001;59A;;;;Le mélèze et l’aune vert dominent, accompagnés du sorbier des oiseleurs et, par endroits, de l’arole. Dans les régions 4 et 5, l’arole est absent. Le peuplement est étagé, avec le mélèze (sur les éminences rocheuses) à l’étage supérieur et l’aulne vert (dans les dépressions alimentées en eau courante) à l’étage inférieur. Degré de fermeture espacé à clairiéré. Arbres à longs houppiers, isolés et, rarement, en troches de quelques arbres.;15;25;28;15;;"Kühl-feuchte, mittel bis stark geneigte Nordhänge mit langer Schneebedeckung, häufig im Bereich von Lawinenzügen
";Versants nord frais et humides, modérément à fortement pentus, avec longue durée d’enneigement, souvent proches de couloirs d’avalanche. ;Sehr üppige Hochstaudenflur, oft mit viel Alpenwaldfarn, auf Kuppen einige Zwergsträucher. In der Regionen 4 und 5 gibt es auch grasreiche Varianten.;Mégaphorbiée très développée, souvent avec athyriums alpestres abondants, quelques buissons nains sur les éminences. Dans les régions 4 et 5, variantes riches en graminées.;Mull, feuchte Ausprägung und Moder, auf Kuppen auch Rohhumus;"Braunerde, stellenweise nasser Ranker, vernässter vernässte und podsolierte Braunerde, Braunpodsol, Podsol
";"Skelettgehalt mittel bis hoch, Gründigkeit mittel, Durchlässigkeit mittel bis gering, leicht vernässt
";Pierrosité moyenne à élevée, profondeur moyenne, perméabilité moyenne à faible, légèrement engorgé.  ;0;0;;;;1;0;1;1;2;2;1;2;0;2;2;2;0;1;1;1;2;2;0;0;0;0;59A;;;;;;;;;;1;;0;;0;;0;0;0;0
59,00002;59C;;;;L’arole domine, accompagné de rares mélèzes et parfois de pins de montagne. Degré de fermeture espacé à clairiéré. Arbres à longs houppiers, isolés et, rarement, en troches de quelques arbres. ;10;15;18;10;;"Silikat, selten auch auf Kalk, stark ausgeprägtes Kleinrelief mit vielen Felsen und Blöcken und wenig feinerdereichen Stellen. Extreme, steile Sonnenhänge, trocken.
";"Roche-mère siliceuse, rarement aussi sur calcaire ; microrelief très marqué avec de petits rochers et blocs et peu d’emplacements riches en terre fine. Versants ensoleillés raides, extrêmes, secs. ";"Artenreiche Krautschicht mit geringer Deckung, dazwischen oft felsige Partien, die höchstens eine Flechtenvegetation zeigen.
";Strate herbacée riche en espèces et à faible degré de recouvrement, entrecoupée de parties rocheuses garnies tout au plus de lichens. ;Moder, trockene Ausprägung, stellenweise Rohhumus, trockene Ausprägung;"Gesteinsrohboden, Ranker, stellenweise podsolierte Braunerde, Braunpodsol
";"Skelettreich, flachgründig, Durchlässigkeit übermässig bis normal
";Forte pierrosité, sol superficiel, perméabilité extrême à normale. ;0;0;;;;1;0;2;0;2;2;1;1;1;2;2;0;0;2;1;1;0;0;0;0;0;0;59C;;;;;;;;;;1;;0;;0;;0;0;2;0
59,00004;59E;;;;Peuplements d’aroles et de mélèzes rabougris, en général lacuneux à clairiérés et en mélange avec quelques pins de montagne. Les aroles et les mélèzes se répartissent par pieds isolés ou en petits groupes. Dans de nombreux vides et trouées, les éboulis et les parties rocheuses sans végétation dominent.  ;15;20;23;13;;"Basenreiche Unterlage (tonarme Kalke, Dolomit), felsige oder blockige  mässig bis stark geneigte Hänge mit hoher Einstrahlung, zeitweise austrocknend
";Substrat riche en bases (calcaire pauvre en argile, dolomie), sur roches ou sur blocs, versants à fort ensoleillement modérément à fortement pentus avec assèchement temporaire.  ;"Mässig bis stark deckende Bodenvegetation die von Zwergsträuchern mit geringer Wuchshöhe dominiert wird. Beweidete Bestände zeigen oft den grasigen Aspekt alpiner Blaugrasrasen. 
";Végétation basse moyennement à très couvrante, dominée par des buissons nains bas. Les peuplements pâturés présentent souvent un aspect herbeux de pelouse à seslérie alpine. ;Moder, Kalkmoder, teilweise trockene Ausprägung;"Gesteinsrohboden, Rendzina
";"Die mineralischen Horizonte sind wenig verwittert, flachgründig und skelettreich, Feinerde ist nur spärlich vorhanden, grosse Durchlässigkeit, die Wasserspeicherkapazität ist gering.
";Les horizons minéraux sont peu altérés, sol superficiel et très pierreux. Terre fine présente uniquement de manière clairsemée, grande perméabilité, faible capacité de rétention. ;9;1;;;;0;1;1;2;1;2;1;1;1;2;2;2;2;2;1;1;2;2;0;0;0;2;59E;;;;;;;;;;1;;0;;0;;0;0;2;0
59,0000401;59ELÜ;59E;U;"Wegen Beeinflussung durch Schneebewegungen/Lawinen dominiert die Lärche, dazu einzelne Arven und Bergföhren.  In den zahlreichen Lücken und Blössen dominieren oft vegetationsfreie Geröll- und Felspartien.  
";En raison de l’influence des mouvements de la neige et des avalanches, le mélèze domine, accompagné de quelques aroles et de pins de montagne. Dans de nombreux vides et trouées, les éboulis et les parties rocheuses sans végétation dominent. ;15;20;23;13;;"Basenreiche Unterlage (tonarme Kalke, Dolomit), felsige oder blockige  mässig bis stark geneigte Hänge mit hoher Einstrahlung, zeitweise austrocknend
";Substrat riche en bases (calcaire pauvre en argile, dolomie), sur roches ou sur blocs, versants à fort ensoleillement modérément à fortement pentus avec assèchement temporaire.  ;"Mässig bis stark deckende Bodenvegetation die von Zwergsträuchern mit geringer Wuchshöhe dominiert wird. Beweidete Bestände zeigen oft den grasigen Aspekt alpiner Blaugrasrasen. 
";Végétation basse moyennement à très couvrante, dominée par des buissons nains bas. Les peuplements pâturés présentent souvent un aspect herbeux de pelouse à seslérie alpine. ;;;;;9;1;;;;0;1;1;2;1;2;1;1;1;2;2;2;2;2;1;1;2;2;0;0;0;2;59ELae;N;Y;Y;Y;Y;;Y;Y;Y;1;;0;;0;;0;0;2;0
59,00005;59J;;;;Peuplements de mélèzes clairiérés à entrouverts, généralement réguliers, avec sorbier des oiseleurs et, rarement, quelques épicéas, sapins, hêtres ou de rares aroles. Souvent fortement influencés par l’homme. Dans l’aire de l’arole, on trouve dans des conditions de station correspondants les types de station 59C ou 59L.;15;25;28;15;;"Silikat. Gleichmässige, eher trockene, steinige Hänge mit teilweise anstehendem Fels. Sonnenhänge. Die feinerdereicheren Lichtungen wurden oft alpwirtschaftlich genutzt. Wenig Schnee. 
";Sol siliceux. Pentes pierreuses régulières, plutôt sèches, avec portions de roches affleurantes. Versants ensoleillés. Les clairières riches en terre fine sont souvent pâturées. Peu de neige. ;"Teppiche von Zwergwacholder und anderen Zwergsträuchern, in Lichtungen grasig.
";Tapis de genévriers nains et autres buissons nains, herbeux dans les clairières. ;Moder, stellenweise Rohhumus, trockene Ausprägungen, teils erodiert;"Ranker, Podsol, Gesteinsrohboden
";"Skelettgehalt gering bis hoch, Gründigkeit flach bis tief, Durchlässigkeit äusserst hoch bis hoch, keine Vernässung.
";Pierrosité faible à élevée, sol superficiel à profond, perméabilité extrêmement élevée à élevée, non hydromorphe. ;0;0;2;;;1;0;1;2;1;2;1;1;1;1;0;2;0;2;1;1;2;1;0;0;0;0;59J;;;;;;;;;;1;;0;;0;;0;0;2;0
59,00006;59L;;H;"Arve dominiert, dazu Lärche (diese ist oft stärker vertreten als in der Ausbildung mit Alpenrose). Teilweise dominiert die Lärche, weil sie durch Kalkschlag oder wegen Beweidung gefördert wurde. Der Schlussgrad ist räumig. Langkronige Einzelbäume oder Rotten mit wenig Bäumen
";L’arole domine, accompagné du mélèze (ce dernier est souvent plus fréquent que dans la variante à rhododendron). L’arole manque parfois, p.ex. dans les zones soumises aux effets des avalanches ou sur d’anciennes zones pâturées. Degré de fermeture espacé. Arbres à longs houppiers, isolés ou en troches de quelques arbres. ;15;25;28;15;;"Meist auf Silikat, selten auch auf Bündnerschiefer, feinerdereiche Böden, nur wenig Felsen und Blockschutt. Meistens Sonnenhänge, trocken.
";"En général, sur roches siliceuses, rarement sur schistes lustrés (Bündnerschiefer) ; sols riches en terre fine, peu de roches et d’éboulis de gros blocs. Le plus souvent versants ensoleillés et secs.  ";"Grasig mit Wollreitgras, dazwischen auch Zwergsträucher 
";Herbeux avec calamagrostide velue, parsemé de buissons nains. ;Moder, stellenweise Rohhumus, Mull, teilweise trockene Ausprägungen, teils erodiert;"Braunerde, Ranker, Regosol, Braunpodsol, Podsol.
";"Skelettgehalt mittel bis sehr hoch, Gründigkeit mittel bis sehr tief, Durchlässigkeit sehr hoch bis mittel, keine Vernässung.
";Pierrosité moyenne à très élevée, sol moyennement profond à très profond, perméabilité très élevée à moyenne, non hydromorphe. ;0;0;9;100;;1;2;1;2;1;2;1;1;2;1;0;2;0;2;1;1;2;1;0;0;0;0;59L;;;;;;;;;;1;;0;;0;;0;0;2;0
59,0000601;59LLÜ;59LLÜ;U;"Wegen Beeinflussung durch Schneebewegungen/Lawinen dominiert die Lärche, die immergrüne Arve kommt nur spärlich vor. Der Schlussgrad ist locker bis räumig. Langkronige Einzelbäume oder Rotten mit wenig Bäumen

";En raison de l’influence des mouvements de la neige et des avalanches, le mélèze domine. L’arole au feuillage persistant n’est présent que de manière clairsemée. Degré de fermeture entrouvert à espacé. Arbres à longs houppiers, isolés ou en troches de quelques arbres.;15;25;28;15;;"Meist auf Silikat, selten auch auf Bündnerschiefer, feinerdereiche Böden, nur wenig Felsen und Blockschutt. Meistens Sonnenhänge, trocken.
";"En général, sur roches siliceuses, rarement sur schistes lustrés (Bündnerschiefer) ; sols riches en terre fine, peu de roches et d’éboulis de gros blocs. Le plus souvent versants ensoleillés et secs. ";"Grasig mit Wollreitgras, dazwischen auch Zwergsträucher 
";Herbeux avec calamagrostide velue, parsemé de buissons nains. ;;;;;0;0;9;100;;1;2;1;2;1;2;1;1;2;1;0;2;0;2;1;1;2;1;0;0;0;0;59LLae;;Y;Y;Y;Y;;Y;Y;Y;1;;0;;0;;0;0;0;0
59,00012;59S;;;;Les mélèzes dominent seuls. Type de station qu’on retrouve dans les régions où l’arole est par nature peu présent voire rare. ;15;25;28;15;;"Kalkhaltige Felsen, Terrassen und steile Hänge. Meistens sonnige Hänge, zeitweise austrocknend.
";Roches calcaires, terrasses et pentes raides. En général, pentes ensoleillées, asséchées temporairement. ;"Lärche dominiert parkartig, darunter Rasen aus Blaugras, Buntreitgras. Silberwurz, mit wenig Sträuchern.
";Le mélèze domine dans une ambiance de parc boisé sur une pelouse composée de sesléries bleuâtres et de calamagrostides bigarrées. Dryade à huit pétales, avec peu de buissons. ;Moder, teilweise Xeromoder.;"Rendzina. Rohboden.
";"Sehr flachgründig und skelettreich, Feinerde mit Humus ist dünn, mit knappe Wasserspeicherkapazität.
";Sol très superficiel et très pierreux, la couche de terre fine avec humus est fine, présente une faible capacité de rétention. ;2;1;9;;;2;1;2;0;1;0;1;1;1;2;9;0;0;2;2;1;2;2;0;0;0;2;59S;;;;;;;;;;1;;0;;0;;0;0;2;0
59,00014;59V;;;;Arolières entrouvertes, parfois sans mélèze, parfois avec le pin de montagne.  ;15;25;28;15;;"Auf Silikatböden oder basenarmen Moränen. Hanglagen und Hangfusslagen
";Sur sols siliceux ou moraines pauvres en bases. Versants et pieds de versants. ;"Wegen ehemaliger Beweidung oft grasig. Moosschicht vorhanden, aber nicht üppig.
";Souvent herbeux par suite de l’ancien pacage. Strate muscinale présente, mais pas luxuriante. ;Moder, stellenweise Rohhumus.;"Podsol, Braunpodsol, podsolierte Braunerde, stellenweise Regosol
";"Skelettgehalt hoch bis sehr hoch, Gründigkeit tief bis sehr tief, Durchlässigkeit sehr hoch bis mittel, keine Vernässung
";Pierrosité élevée à très élevée, sol profond à très profond, perméabilité très élevée à moyenne, non hydromorphe. ;0;0;2;;;1;2;1;2;2;2;2;0;0;2;0;0;0;2;1;1;2;2;0;0;0;0;59V;;;;;;;;;;1;;0;;0;;0;0;0;0
59,0001401;59VLÜ;59V;U;"Wegen Beeinflussung durch Schneebewegungen/Lawinen dominiert die Lärche, Vogelbeere ist beigemischt, die immergrüne Arve kommt nur spärlich vor.
";En raison de l’influence des mouvements de la neige et des avalanches, le mélèze domine, en mélange avec le sorbier des oiseleurs. L’arole au feuillage persistant n’est présent que de manière clairsemée. ;15;25;28;15;;"Auf Silikatböden oder basenarmen Moränen. Hanglagen und Hangfusslagen
";Sur sols siliceux ou moraines pauvres en bases. Versants et pieds de versants. ;"Wegen ehemaliger Beweidung oft grasig. Moosschicht vorhanden, aber nicht üppig.
";Souvent herbeux par suite de l’ancien pacage. Strate muscinale présente, mais pas luxuriante. ;;;;;0;0;2;;;1;2;1;2;2;2;2;0;0;2;0;0;0;2;1;1;2;2;0;0;0;0;59VLae;;;;;;;;;;1;;0;;0;;0;0;0;0
59,00016;59H;;;;Peuplements d’aroles et de mélèzes rabougris, en général lacuneux à clairiérés et en mélange avec quelques pins de montagne. Les aroles et les mélèzes se répartissent par pieds isolés ou en petits groupes. Dans de nombreux vides et trouées se développe, sur plus d’un mètre de hauteur, une vigoureuse végétation buissonnante naine. Les peuplements sont en général parsemés de blocs rocheux et de parties dépourvues d’arbres.  ;15;20;23;13;;"Basenreiche Unterlage (tonarme Kalke, Dolomit), felsige oder blockige  Nordlagen, kalt, geringe Einstrahlung, oft taufeucht, zeitweise austrocknend, mässig bis stark geneigt
";Substrat riche en bases (calcaire pauvre en argile, dolomie), sur roches ou sur blocs, versants nord, climat froid, faible ensoleillement, souvent humidité de rosée, assèchement temporaire, versants modérés à fortement pentus. ;"Stark deckende Bodenvegetation, üppige Zwergstrauchvegetation, Rhododendren. Aspektdominierende Moosschicht, im Interzeptionsbereich oft vegetationsarm, Krautpflanzen und Grasartige sind vor allem auf anstehendem  mineralischen Material herdenweise eingestreut. 
";Végétation basse très couvrante, buissons nains luxuriants, rhododendron. Aspect dominé par la strate muscinale dans les couches d’interception, souvent pauvre en végétation. Les plantes herbacées et les graminées sont principalement parsemés sur les zones caractérisées par des matériaux minéraux. ;Rohhumus, Tangelhumus, Xeromoder.;"Gesteinsrohboden, Rendzina
";"Die mineralischen Horizonte sind wenig verwittert, flachgründig und skelettreich, Feinerde ist nur spärlich vorhanden, grosse Durchlässigkeit, die Wasserspeicherkapazität ist gering.
";Les horizons minéraux sont peu altérés, superficiels et très pierreux. Terre fine présente uniquement de manière clairsemée, grande perméabilité, faible capacité de rétention. ;9;1;;;;0;1;1;2;2;2;1;1;1;2;2;2;2;2;1;1;2;2;0;0;0;0;59H;;;;;;;;;;1;;0;;0;;0;0;2;0
59,00018;59R;;;;Peuplements de mélèzes de croissance moyenne entrouverts à clairiérés auxquels peuvent être mélangés quelques aroles ou épicéas. Des sorbiers des oiseleurs ou des alisiers blancs à plus ou moins gros houppiers sont souvent présents en peuplement accessoire. Les peuplements sont souvent à un stade pionnier et témoignent de l’existence d’anciens pâturages. La surface du sol a un aspect généralement herbeux ou se caractérise par des surfaces d’éboulis exposés à la chaleur du soleil et clairsemées de végétation.  ;15;28;30;20;;"Sonderwaldstandort. Mehr oder weniger aktiver Blockschutt mit mittlerer bis feiner Blockgrösse. Harte, granitische oder serpentinithaltige Gesteine. Die mässig steilen Schutthalden finden sich im Schuttablagerungsbereich und zeigen immer eine starke Einstrahlung
";Station forestière particulière. Éboulis plus ou moins actifs composés de pierres de taille moyenne à fine. Roches dures, granitiques ou contenant de la serpentine. Ces éboulis modérément raides se situent dans la zone de dépôt et sont toujours soumis un fort rayonnement solaire. ;"Grasige, oft etwas lückige, aber artenreiche Bodenvegetation. Die Blöcke wirken kahl, oft mit Flechten bewachsen, Moose sind höchstens spärlich vorhanden.
";Herbeux, végétation basse souvent quelque peu lacunaire, mais riche en espèces. Les blocs sont généralement nus, souvent recouverts de lichens.  Mousses tout au plus présentes de manière clairsemée. ;Moder mit einzelnen Humustaschen;"Feinmaterialarme Gesteinsrohböden, Ranker 
";"Zeitweise stark austrocknend und überhitzend, auf bewegtem Blockschutt sind oft Restbasen und Nährstoffe vorhanden.
";Sol périodiquement fortement asséché et surchauffé, présence fréquente de bases résiduelles et de nutriments sur les éboulis actifs.   ;0;0;;;;0;0;1;2;0;0;0;2;0;2;0;1;1;1;1;1;0;2;0;0;0;0;59R;;;;;;;;;;0;;1;;0;;0;0;0;0
59,1;59*;;;;Peuplements entrouverts à clairiérés, d’aspect souvent uniforme, constitués de mélèzes avec des aulnes verts et des quelques sorbiers des oiseleurs disséminés. Stations garnies de nombreux rhododendrons en dehors de l’aire de répartition de l’arole, correspond à peu près à une arolière à rhododendron (59) sans arole.;15;25;28;15;;"Kühle Lagen, oft grober, ruhender Blockschutt mit kältespeichernden Hohlräumen. Feinerdereichere Flächen wurden oft alpwirtschaftlich genutzt. Flache Lagen und mässig geneigte Schattenhänge, oft lange von Schnee bedeckt.
";Lieux frais, souvent éboulis de gros blocs stabilisés avec cavités retenant le froid. Les surfaces riches en terre fine ont souvent été pâturées. Plats et versants ombragés peu pentus, souvent longtemps recouverts de neige. ;Bis über 1 m hohe Alpenrosen, dazwischen kniehohe Heidelbeeren und Grünerlen. In stark beweideten Beständen grasige Vegetation.;Rhododendrons dépassant parfois 1 m côtoyant des aunes verts et myrtilles à hauteur du genou. Végétation herbacée dans les peuplements fortement pâturés.;Rohhumus;"Podsol auf Blockschutt, stellenweise Gesteinsrohboden, Ranker, Humuspodsol
";"Skelettgehalt gering bis äusserst hoch, Gründigkeit gering bis sehr tief, Durchlässigkeit hoch bis äusserst hoch, keine Vernässung.
";Pierrosité faible à extrêmement élevée, sol peu profond à très profond, perméabilité élevée à extrêmement élevée, non hydromorphe. ;0;0;2;;;1;0;1;1;2;2;1;1;1;2;0;0;0;2;1;1;0;0;0;0;0;0;59Stern;;;;;;;;;;1;;0;;0;;0;0;2;0
