NAISTYP_SORT; NAISTYP_C; NAISTYP_S20; NAISTYP_NAME_LAT; NAISTYP_NAME_DEU; NAISTYP_NAMK_DEU; NAISTYP_NAME_FRZ; NAISTYP_NAMK_FRZ; NTYP_C_ANHANG2A; NTYP_C_BSCHR_SEP; NTYP_C_BSCHR_TI; NTYP_W_B_ETAP1; NTYP_W_B_ETAP2; NTYP_G_P_ETAP1; NTYP_G_P_ETAP2; NTYP_BS_ETAP1; NTYP_BS_ETAP2; NTYP_SSKSMS_ETA1; NTYP_SSKSMS_ETA2; NTYP_DELARZE08; NTYP_C_ABGES; NTYP_C_GFX_ORT; NTYP_C_GFX_BODEN; NAISTYP_GFX; NAISTYP_WGES; NAISTYP_ANFP; NAISTYP_GFK; NAISTYP_GFEI; NAISTYP_GRB; NAISTYP_ANFP_05; NAISTYP_BEM; NTYP_NATP_ABK; NTYP_NATP_BED
1;1;Y;Luzulo sylvaticae-/L. niveae-Fagetum typicum;Typischer Hainsimsen-Buchenwald;Typischer Hainsimsen-Bu-Wald;Hêtraie à  Luzule des forêts typique;;x;;;Y;Y;Y;Y;Y;Y;Y;Y;;;x;x;1;Typischer Hainsimsen-Bu-Wald;1 2;BUSM;Buche submontan mittel;Buchenwälder;;"neues Anforderungsprofil; 7a 9a 9w mit Waldföhre; Traubeneiche";1;"Submontan; untermontan"
1.009;1h     ;Y;"Luzulo-Abieti-Fagetum; artenarme Ausbildung";Artenarmer Waldsimsen-Tannen-Buchenwald;Artenarmer Waldsimsen-Ta-Bu-Wald;"Hêtraie à  Luzule des forêts typique; var. d'altitude";;x;;;Y;Y;Y;Y;Y;Y;Y;Y;;;x;x;1h;Artenarmer Waldsimsen-Ta-Bu-Wald;1h;TABUM;Tanne-Buche mittel;Tannen-Buchenwälder;1h;;1;Obermontan
2;2;Y;Luzulo-Fagetum leucobryetosum;Hainsimsen-Buchenwald mit Weissmoos;Hainsimsen-Bu-Wald mit Weissmoos;Hêtraie à  Luzule des forêts avec Leucobryum;;;;;Y;Y;Y;Y;Y;Y;Y;Y;;;x;x;2;Hainsimsen-Buchenwald mit Weissmoos;1 2;BUSM;Buche submontan mittel;Buchenwälder;;"neues Anforderungsprofil; 7a 9a 9w mit Waldföhre; Traubeneiche";2;
3;3;Y;Luzulo niveae-Fagetum typicum;Typischer Schneesimsen-Buchenwald;Typischer Schneesimsen-Bu-Wald;Hêtraie à  Luzule blanc-de-neige typique;;x;;;Y;;Y;;Y;;Y;;;;x;x;3;Typischer Schneesimsen-Bu-Wald;3;EIBU;Eiche-Buche;Buchenwälder;3;;3;Mit einzelen Trockenheitszeigern 
3.000001;3s     ;Y;"Luzulo niveae-Fagetum; trockene Ausbildung";Trockener Schneesimsen-Buchenwald;Trockener Schneesimsen-Bu-Wald;Hêtraie à  Luzule blanc-de-neige sur sol sec;;;;x;Y;;Y;;Y;;Y;;;;x;x;3s;Trockener Schneesimsen-Bu-Wald;3s;EIBU;Eiche-Buche;Buchenwälder;;"neues Anforderungsprofil 3(42). Im Klimax Bu; einzelne Traubeneichen; praktisch keine Ta; Fi. Max. Baumhöhe << 15 m";3;Mit vielen Trockenheitszeigern
3.00015;3LV    ;Y;"Ilici-Fagetum typicum; nährstoffarme Ausbildung";Nährstoffarmer Buchenwald mit Stechpalme;Nährstoffarmer Bu-Wald mit Stechpalme;Hêtraie oligotrophe à  Houx;;x 3VL;;;Y;;Y;;Y;;Y;;;;x;;3LV;Nährstoffarmer Bu-Wald mit Stechpalme;3LV;EIBU;Eiche-Buche;Buchenwälder;3VL;;3*;Mit Vaccinium myrtillus
3.01;3L/4L  ;Y;Ilici-Fagetum typicum und dryopteridetosum;Mesophiler Buchenwald mit Stechpalme;Mesophiler Bu-Wald mit Stechpalme;Hêtraie mésotrophe à  Houx;;x 3mL-4L;;;Y;;Y;;Y;;Y;;;;x;x;3L_4L;Mesophiler Bu-Wald mit Stechpalme;3L/4L;EIBU;Eiche-Buche;Buchenwälder;3mL-4L;3mL-4L;3*;Ohne Vaccinium myrtillus
3.1;3*/4*  ;Y;Rhododendro-Fagetum;Alpenrosen-Buchenwald;Alpenrosen-Bu-Wald;Hêtraie à  Rhododendron;;;;x;Y;;Y;;Y;;Y;;;;x;;3Stern;Typischer Alpenrosen-Bu-Wald;3* 4*;EIBU;Eiche-Buche;Buchenwälder;;neues Anforderungsprofil 3(47*);3**;
4;4;Y;Luzulo niveae-Fagetum dryopteridetosum;Farnreicher Schneesimsen-Buchenwald;Farnreicher Schneesimsen-Bu-Wald;Hêtraie à  Luzule blanc-de-neige riche en fougères;;x;;;Y;;Y;;Y;;Y;;;;x;x;4;Farnreicher Schneesimsen-Bu-Wald;4;BUTA;Buche-Tanne ;Buchenwälder;4;;4;
6;6;Y;Galio odorati-Fagetum luzuletosum;Waldmeister-Buchenwald mit Hainsimse;Waldmeister-Bu-Wald mit Hainsimse;Hêtraie à  Aspérule avec Luzule des forêts;;;x;;Y;Y;Y;Y;Y;Y;Y;Y;;;x;x;6;Waldmeister-Bu-Wald mit Hainsimse;6 7a 9a 9w;BUSM;Buche submontan mittel;Buchenwälder;;Anforderungsprofil von 7a;6;Ohne anstehendem  Fels
6.000003;6Fe    ;Y;"Galio odorati-Fagetum luzuletosum; Ausbildung auf Fels";Waldmeister-Buchenwald mit Hainsimse auf Fels;Waldmeister-Bu-Wald mit Hainsimse auf Fels;Hêtraie à  Aspérule avec Luzule des forêts sur rochers;;;;;;;;;;;;;;;x;;6Fe;Waldmeister-Bu-wald mit Hainsimse auf Fels;6 7a 9a 9w;BUSM;Buche submontan mittel;Buchenwälder;;;6;Mit anstehendem Fels
7.00012;7S     ;Y;Galio-Fagetum stachyetosum sylvaticae;Feuchter Waldmeister-Buchenwald;Feuchter Waldmeister-Bu-Wald;Hêtraie à  Aspérule avec Épiaire des forêts;;x;;;Y;Y;Y;Y;Y;Y;Y;Y;;;x;x;7S;Feuchter Waldmeister-Bu-Wald;7S 11;BUF;Buche feucht;Buchenwälder;7S 11;;7;"Mit Feuchtezeigern; ohne Säurezeiger; ohne anstehendem Fels"
7.000123;7SFe   ;Y;"Galio-Fagetum stachyetosum sylvaticae; Ausbildung auf Fels";Feuchter Waldmeister-Buchenwald auf Fels;Feuchter Waldmeister-Bu-Wald auf Fels;Hêtraie à  Aspérule avec Épiaire sur rochers;;;;;;;;;;;;;;;x;;7SFe;Feuchter Waldmeister-Bu-Wald auf Fels;7S 11;BUF;Buche feucht;Buchenwälder;;;7;"Mit Feuchtezeigern; ohne Säurezeiger; mit anstehendem Fels"
7.001;7a     ;Y;Galio-Fagetum typicum;Typischer Waldmeister-Buchenwald;Typischer Waldmeister-Bu-Wald;Hêtraie à  Aspérule typique;;x;;;Y;Y;Y;Y;Y;Y;Y;Y;;;x;x;7a;Typischer Waldmeister-Bu-Wald;6 7a 9a 9w;BUSM;Buche submontan mittel;Buchenwälder;7a 9a 9w;;7;"Ohne Feuchtezeiger; ohne Säurezeiger;  ohne anstehendem Fels"
7.001003;7aFe   ;Y;"Galio-Fagetum typicum; Ausbildung auf Fels";Typischer Waldmeister-Buchenwald auf Fels;Typischer Waldmeister-Bu-Wald auf Fels;Hêtraie à  Aspérule typique sur rochers;;;;;;;;;;;;;;;x;;7aFe;Typischer Waldmeister-Bu-Wald auf Fels;6 7a 9a 9w;BUSM;Buche submontan mittel;Buchenwälder;;;7;"Ohne Feuchtezeiger; ohne Säurezeiger;  mit anstehendem Fels"
7.002;7b     ;Y;Galio-Fagetum caricetosum remotae;Waldmeister-Buchenwald mit Lockerähriger Segge;Waldmeister-Bu-Wald mit Lockerähriger Segge;Hêtraie à  Aspérule avec Laiche à  épis espacés ;;;;;;;;;;;;;;;x;;7b;Typischer Waldmeister-Buchenwald mit Lockerähriger Segge;7b;BUSM;Buche submontan mittel;Buchenwälder;;neues Anforderungsprofil;7;"Mit Feuchtezeigern; mit Säurezeiger"
7.1;7*     ;Y;Galio-Fagetum blechnetosum;Waldmeister-Buchenwald mit Rippenfarn;Waldmeister-Bu-Wald mit Rippenfarn;Hêtraie à  Aspérule avec Blechnum;;;x;;Y;Y;Y;Y;Y;Y;Y;Y;;;x;x;7Stern;Waldmeister-Bu-Wald mit Rippenfarn;7* 8*;TABUM;Tanne-Buche mittel;Tannen-Buchenwälder;;;7*;
8.00012;8S     ;Y;Milio-Fagetum stachyetosum sylvaticae;Feuchter Waldhirsen-Buchenwald;Feuchter Waldhirsen-Bu-Wald;Hêtraie à  Millet avec Épiaire des forêts;;x;;;Y;Y;Y;Y;Y;Y;Y;Y;;;x;x;8S;Feuchter Waldhirsen-Bu-Wald;8S 12S;BUF;Buche feucht;Buchenwälder;8S 12S;;8;"Mit Feuchtezeigern; ohne Säurezeiger ohne anstehendem Fels"
8.000123;8SFe   ;Y;"Milio-Fagetum stachyetosum sylvaticae; Ausbildung auf Fels";Feuchter Waldhirsen-Buchenwald auf Fels;Feuchter Waldhirsen-Bu-Wald auf Fels;Hêtraie à  Millet avec Épiaire des forêts sur rochers;;;;;;;;;;;;;;;x;;8SFe;Feuchter Waldhirsen-Bu-Wald auf Fels;8S 12S;BUF;Buche feucht;Buchenwälder;;;8;"Mit Feuchtezeigern; ohne Säurezeiger; mit anstehendem Felsen"
8.001;8a     ;Y;Milio-Fagetum typicum;Typischer Waldhirsen-Buchenwald;Typischer Waldhirsen-Bu-Wald;Hêtraie à  Millet typique;;x;;;Y;Y;Y;Y;Y;Y;Y;Y;;;x;x;8a;Typischer Waldhirsen-Bu-Wald;8d 8a 12a;BUUM;Buche untermontan mittel;Buchenwälder;8a 12a;;8;"Ohne Feuchtezeiger; ohne Säurezeiger;  ohne anstehendem Felsen"
8.001003;8aFe   ;Y;"Milio-Fagetum typicum; Ausbildung auf Fels";Typischer Waldhirsen-Buchenwald auf Fels;Typischer Waldhirsen-Bu-Wald auf Fels;Hêtraie à  Millet typique sur rochers;;;;;;;;;;;;;;;x;;8aFe;Typischer Waldhirsen-Bu-Wald auf Fels;8d 8a 12a;BUUM;Buche untermontan mittel;Buchenwälder;;;8;"Ohne Feuchtezeiger; ohne Säurezeiger;  mit anstehendem Felsen"
8.002;8b     ;Y;Milio-Fagetum caricetosum remotae;Waldhirsen-Buchenwald mit Lockerähriger Segge;Waldhirsen-Bu-Wald mit  Lockerähriger Segge;Hêtraie à  Aspérule avec Laiche à  épis espacés ;;;;;;;;;;;;;;;x;;8b;Typischer Waldhirsenbuchenwald mit Lockerähriger Segge;8b;BUUM;Buche untermontan mittel;Buchenwälder;;neues Anforderungsprofil;8;"Mit Feuchtezeigern; mit Säurezeiger"
8.004;8d     ;Y;Milio-Fagetum luzuletosum;Waldhirsen-Buchenwald mit Hainsimse;Waldhirsen-Bu-Wald mit Hainsimse;Hêtraie à  Millet avec Luzule des forêts;;;x;;Y;Y;Y;Y;Y;Y;Y;Y;;;x;x;8d;Waldhirsen-Bu-Wald mit Hainsimse;8d 8a 12a;BUUM;Buche untermontan mittel;Buchenwälder;;Anforderungsprofil von 8a;8;"Ohne Feuchtezeiger; mit Säurezeigern;  ohne anstehendem Fels"
8.004003;8dFe   ;Y;"Milio-Fagetum luzuletosum; Ausbildung auf Fels";Waldhirsen-Buchenwald mit Hainsimse auf Fels;Waldhirsen-Bu-Wald mit Hainsimse auf Fels;Hêtraie à  Millet avec Luzule des forêts sur rochers;;;;;;;;;;;;;;;x;;8dFe;Waldhirsen-Bu-Wald mit Hainsimse auf Fels;8d 8a 12a;BUUM;Buche untermontan mittel;Buchenwälder;;;8;"Ohne Feuchtezeiger; mit Säurezeigern;  mit anstehendem Fels"
8.1;8*     ;Y;Milio-Fagetum blechnetosum;Waldhirsen-Buchenwald mit Rippenfarn;Waldhirsen-Bu-Wald mit Rippenfarn;Hêtraie à  Millet avec Blechnum spicant;;x;;;Y;Y;Y;Y;Y;Y;Y;Y;;;x;x;8Stern;Waldhirsen-Bu-Wald mit Rippenfarn;7* 8*;TABUM;Tanne-Buche mittel;Tannen-Buchenwälder;8*;;8*;
9.001;9a     ;Y;Pulmonario-/ Lathyro-Fagetum typicum;Typischer Lungenkraut-/Platterbsen-Buchenwald;Typischer Lungenkraut-/Platterbsen-Bu-Wald;Hêtraie à  Pulmonaire typique;;x;;;Y;Y;Y;Y;Y;Y;Y;Y;;;x;x;9a;Typischer Lungenkraut-/Platterbsen-Bu-Wald;6 7a 9a 9w;BUSM;Buche submontan mittel;Buchenwälder;7a 9a 9w;;9;"Ohne Wechselfeuchtigkeitszeigern; ohne anstehendem Fels"
9.001003;9aFe   ;Y;"Pulmonario-/ Lathyro-Fagetum typicum; Ausbildung auf Fels";Typischer Lungenkraut-/Platterbsen-Buchenwald auf Fels;Typischer Lungenkraut-/Platterbsen-Bu-Wald auf Fels;Hêtraie à  Pulmonaire typique sur rochers;;;;;;;;;;;;;;;x;;9aFe;Typischer Lungenkraut-/Platterbsen-Bu-Wald auf Fels;6 7a 9a 9w;BUSM;Buche submontan mittel;Buchenwälder;;;9;"Ohne Wechselfeuchtigkeitszeigern; mit anstehendem Fels"
9.014;9w     ;Y;Pulmonario-/ Lathyro-Fagetum caricetosum flaccae;Wechselfeuchter Lungenkraut-/Platterbsen-Buchenwald;Wechselfeuchter Lungenkraut-/Platterbsen-Bu-Wald;Hêtraie à  Pulmonaire avec Laiche glauque;;x;;;Y;Y;Y;Y;Y;Y;Y;Y;;;x;x;9w;Wechselfeuchter Lungenkraut-/Platterbsen-Bu-Wald;6 7a 9a 9w;BUSM;Buche submontan mittel;Buchenwälder;7a 9a 9w;;9;Mit Wechselfeuchtigkeitszeigern
10.001;10a    ;Y;Pulmonario-/ Lathyro-Fagetum melittetosum;Lungenkraut-/Platterbsen-Buchenwald mit Immenblatt;Lungenkraut-/Platterbsen-Bu-Wald mit Immenblatt;Hêtraie à  Pulmonaire avec Mélitte;;x;;;Y;Y;Y;Y;Y;Y;Y;Y;;;x;x;10a;Lungenkraut-/Platterbsen-Bu-Wald mit Immenblatt;10a 10w 14 15;BUT;Buche trocken;Buchenwälder;10a 10w 14 15;;10;Ohne Wechselfeuchtigkeitszeigern
10.014;10w    ;Y;"Pulmonario-/ Lathyro-Fagetum melittetosum; Ausbildung mit Carex flacca";Wechseltrockener Lungenkraut-/Platterbsen-Buchenwald mit Immenblatt;Wechseltrockener Lungenkraut-/Platterbsen-Bu-Wald mit Immenblatt;Hêtraie à  Pulmonaire avec Mélitte et Laiche glauque;;x;;;Y;Y;Y;Y;Y;Y;Y;Y;;;x;x;10w;Wechseltrockener Lungenkraut-/Platterbsen-Bu-Wald mit Immenblatt;10a 10w 14 15;BUT;Buche trocken;Buchenwälder;10a 10w 14 15;;10;Mit Wechselfeuchtigkeitszeigern
11;11;Y;Aro-Fagetum;Aronstab-Buchenwald;Aronstab-Bu-Wald;Hêtraie à  Gouet;;x;;;Y;Y;Y;Y;Y;Y;Y;Y;;;x;x;11;Aronstab-Bu-Wald;7S 11;BUF;Buche feucht;Buchenwälder;7S 11;;11;Ohne anstehendem  Fels
11.000003;11Fe   ;Y;"Aro-Fagetum; Ausbildung auf Fels";Aronstab-Buchenwald auf Fels;Aronstab-Bu-Wald auf Fels;Hêtraie à  Gouet sur rochers;;;;;;;;;;;;;;;x;;11Fe;Aronstab-Bu-Wald auf Fels;7S 11;BUF;Buche feucht;Buchenwälder;;;11;Mit anstehendem Fels
12.00012;12S    ;Y;Mercuriali-/Cardamino-Fagetum circaetosum;Feuchter Bingelkraut-/Zahnwurz-Buchenwald;Feuchter Bingelkraut-/Zahnwurz-Bu-Wald;Hêtraie à  Dentaire avec Épiaire des forêts;;x;;;Y;Y;Y;Y;Y;Y;Y;Y;;;x;x;12S;Feuchter Bingelkraut-/Zahnwurz-Bu-Wald;8S 12S;BUF;Buche feucht;Buchenwälder;8S 12S;;12;"Mit Feuchtezeigern; ohne anstehendem Fels"
12.000123;12SFe  ;Y;"Mercuriali-/Cardamino-Fagetum circaetosum; Ausbildung auf Fels";Feuchter Bingelkraut-/Zahnwurz-Buchenwald auf Fels;Feuchter Bingelkraut-/Zahnwurz-Bu-Wald auf Fels;Hêtraie à  Dentaire avec Épiaire des forêts sur rochers;;;;;;;;;;;;;;;x;;12SFe;Feuchter Bingelkraut-/Zahnwurz-Bu-Wald auf Fels;8S 12S;BUF;Buche feucht;Buchenwälder;;;12;"Mit Feuchtezeigern; mit anstehendem Fels"
12.001;12a    ;Y;Mercuriali-/Cardamino-Fagetum typicum;Typischer Bingelkraut-/Zahnwurz-Buchenwald;Typischer Bingelkraut-/Zahnwurz-Bu-Wald;Hêtraie à  Dentaire typique;;x;;;Y;Y;Y;Y;Y;Y;Y;Y;;;x;x;12a;Typischer Bingelkraut-/Zahnwurz-Bu-Wald;8d 8a 12a;BUUM;Buche untermontan mittel;Buchenwälder;8a 12a;;12;"Ohne Feuchtezeiger; ohne Trockenheitszeiger; ohne Wechselfeuchtigkeitszeiger; ohne anstehendem Fels"
12.001003;12aFe  ;Y;"Mercuriali-/Cardamino-Fagetum typicum; Ausbildung auf Fels";Typischer Bingelkraut-/Zahnwurz-Buchenwald auf Fels;Typischer Bingelkraut-/Zahnwurz-Bu-Wald auf Fels;Hêtraie à  Dentaire typique sur rochers;;;;;;;;;;;;;;;x;;12aFe;Typischer Bingelkraut-/Zahnwurz-Bu-Wald auf Fels;8d 8a 12a;BUUM;Buche untermontan mittel;Buchenwälder;;;12;"Ohne Feuchtezeiger; ohne Trockenheitszeiger; ohne Wechselfeuchtigkeitszeiger; mit anstehendem Fels"
12.005;12e    ;Y;Mercuriali-/Cardamino-Fagetum caricetosum albae;Trockener Bingelkraut-/Zahnwurz-Buchenwald;Trockener Bingelkraut-/Zahnwurz-Bu-Wald;Hêtraie à  Dentaire avec Laiche blanche;;x;;;Y;Y;Y;Y;Y;Y;Y;Y;;;x;x;12e;Trockener Bingelkraut-/Zahnwurz-Bu-Wald;12e 12w;BUUM;Buche trocken;Buchenwälder;12e 12w;;12;"Mit Trockenheitszeigern; ohne Wechselfeuchtigkeitszeigern"
12.014;12w    ;Y;Mercuriali-/Cardamino-Fagetum caricetosum flaccae;Wechselfeuchter Bingelkraut-/Zahnwurz-Buchenwald;Wechselfeuchter Bingelkraut-/Zahnwurz-Bu-Wald;Hêtraie à  Dentaire avec Laiche glauque;;x;;;Y;Y;Y;Y;Y;Y;Y;Y;;;x;x;12w;Wechselfeuchter Bingelkraut-/Zahnwurz-Bu-Wald;12e 12w;BUUM;Buche trocken;Buchenwälder;12e 12w;;12;Mit Wechselfeuchtigkeitszeigern
12.1;12*    ;Y;Cardamino-Fagetum insubricum sl.;Mesophiler insubrischer Kalk-Buchenwald;Mesophiler insubrischer Kalk-Bu-Wald;Hêtraie mésophile insubrienne sur calcaire;;x;;;Y;;Y;;Y;;Y;;;;x;;12Stern;Mesophiler insubrischer Kalk-Bu-Wald;12*;BUUM;Buche untermontan mittel;Buchenwälder;12*;;12*;Unterhalb ca 1400 m über Meer
12.109;12*h   ;Y;Cardamino-Fagetum veratretosum;Kalk-Buchenwald der insubrischen Gebirge;Kalk-Bu-Wald der insubrischen Gebirge;"Hêtraie insubrienne sur calcaire; variante d'altitude";;x;;;Y;;Y;;Y;;Y;;;;x;;12Sternh;Kalk-Bu-Wald der insubrischen Gebirge;12*h;TABUS;Tanne-Buche mittel;Buchenwälder;12*h;;12*;Oberhalb ca 1400 m über Meer
13.001;13a    ;Y;Tilio-Fagetum typicum;Typischer Linden-Buchenwald;Typischer Linden-Bu-Wald;Hêtraie à  Tilleul typique;;x;;;Y;Y;Y;Y;Y;Y;Y;Y;;;x;x;13a;Typischer Linden-Bu-Wald;13a;BUS;Buche Schutt;Buchenwälder;13a;;13;"Ohne  Trockenheitszeigern;  ohne anstehendem Fels; Region J; M; 1; 2a"
13.001003;13aFe  ;Y;"Tilio-Fagetum typicum; Ausbildung auf Fels";Typischer Linden-Buchenwald auf Fels;Typischer Linden-Bu-Wald auf Fels;Hêtraie à  Tilleul typique sur rochers;;;;;;;;;;;;;;;x;;13aFe;Typischer Linden-Bu-Wald auf Fels;13a;BUS;Buche Schutt;Buchenwälder;;;13;"Ohne  Trockenheitszeigern;  mit anstehendem Fels; Region J; M; 1; 2a"
13.005;13e    ;Y;Tilio-Fagetum caricetosum albae;Trockener Linden-Buchenwald;Trockener Linden-Bu-Wald;Hêtraie à  Tilleul avec Laiche blanche;;x;;;Y;Y;Y;Y;Y;Y;Y;Y;;;x;x;13e;Trockener Linden-Bu-Wald;13e;BUS;Buche Schutt;Buchenwälder;13e ;;13;"Mit Trockenheitszeigern; Region J; M; 1; 2a"
13.006;13eh   ;Y;Adenostylo-Fagetum seslerietosum;Trockener Alpendost-Buchenwald;Trockener Alpendost-Bu-Wald;Hêtraie à  Adénostyle avec Seslérie;;x;;;Y;Y;Y;Y;Y;Y;Y;Y;;;x;;13eh;Trockener Alpendost-Bu-Wald;13eh;TABUS;Tanne-Buche Schutt;Tannen-Buchenwälder;13eh;;13*;"Mit Trockenheitszeigern; Region J; M; 1; 2a"
13.009;13h    ;Y;Adenostylo-Fagetum typicum;Typischer Alpendost-Buchenwald;Typischer Alpendost-Bu-Wald;Hêtraie à  Adénostyle typique;;x;;;Y;Y;Y;Y;Y;Y;Y;Y;;;x;x;13h;Typischer Alpendost-Bu-Wald;13h;TABUS;Tanne-Buche Schutt;Tannen-Buchenwälder;13h;;13*;"Ohne  Trockenheitszeigern;  ohne anstehendem Fels; Region J; M; 1; 2a"
13.009003;13hFe  ;Y;"Adenostylo-Fagetum typicum; Ausbildung auf Fels";Typischer Alpendost-Buchenwald auf Fels;Typischer Alpendost-Bu-Wald auf Fels;Hêtraie à  Adénostyle typique sur rochers;;;;;;;;;;;;;;;x;;13hFe;Typischer Alpendost-Bu-Wald auf Fels;13h;TABUS;Tanne-Buche Schutt;Tannen-Buchenwälder;;;13*;"Ohne  Trockenheitszeigern;  mit anstehendem Fels; Region J; M; 1; 2a"
13.1;13*    ;Y;"Tilio-Fagetum; insubrische Ausbildung";Insubrischer Linden-Buchenwald ;Insubrischer Linden-Bu-Wald ;Hêtraie à  Tilleul insubrienne;;;;x;Y;Y;Y;Y;Y;Y;Y;Y;;;x;;13Stern;Insubrischer Linden-Bu-Wald ;13*;BUS;Buche Schutt;Buchenwälder;;"neues Anforderungsprofil: 13a mit Stechpalme; Eibe; Laburnum; Kastanie; Kirsche; Bu; Sommer- und Winterlinde";13;Region 5
14;14;Y;Carici (albae)-Fagetum typicum;Seggen-Buchenwald mit Weissegge;Seggen-Bu-Wald mit Weissegge;Hêtraie à  Laiche typique;;x;;;Y;Y;Y;Y;Y;Y;Y;Y;;;x;x;14;Seggen-Bu-Wald mit Weissegge;10a 10w 14 15;BUT;Buche trocken;Buchenwälder;10a 10w 14 15;;14;" Region J; M; 1; 2a"
14.1;14*    ;Y;Cephelanthero-Fagetum insubricum s. l.;Trockener insubrischer Kalk-Buchenwald;Trockener insubrischer Kalk-Bu-Wald;Hêtraie xérophile insubrienne sur calcaire;;x;;;Y;;Y;;Y;;Y;;;;x;;14Stern;Trockener insubrischer Kalk-Bu-Wald;14*;BUT;Buche trocken;Buchenwälder;14*;;14;Region 5
15;15;Y;Carici-Fagetum caricetosum montanae;Seggen-Buchenwald mit Bergsegge;Seggen-Bu-Wald mit Bergsegge;Hêtraie à  Laiche avec Laiche des montagnes;;x;;;Y;Y;Y;Y;Y;Y;Y;Y;;;x;x;15;Seggen-Bu-Wald mit Bergsegge;10a 10w 14 15;BUT;Buche trocken;Buchenwälder;10a 10w 14 15;;15;
16;16;Y;Seslerio-Fagetum;Typischer Blaugras-Buchenwald;Typischer Blaugras-Bu-Wald;Hêtraie à  Seslérie typique;;x;;;Y;Y;Y;Y;Y;Y;Y;Y;;;x;x;16;Blaugras-Bu-Wald;16;BUE;Buche extrem;Buchenwälder;;selten Schutzwaldpflege;16;" Region J; M; 1; 2a"
16.1;16*    ;Y;"Seslerio-Fagetum; insubrische Ausbildung";Insubrischer Blaugras-Buchenwald;Insubrischer Blaugras-Bu-Wald;Hêtraie à  Seslérie insubrienne;;;;x;Y;;Y;;Y;;Y;;;;x;;16Stern;Insubrischer Blaugras-Bu-Wald;16*;BUE;Buche extrem;Buchenwälder;;"keine Schutzwaldpflege; 16 mit mehr Hopfenbuche";16;Region 5
17;17;Y;Taxo-Fagetum / Seslerio-Fagetum calamagrostietosum variae;Eiben-Buchenwald/Steilhang-Buchenwald mit Reitgras;Eiben-Bu-Wald/Steilhang-Bu-Wald mit Reitgras;Hêtraie à  If / Hêtraie de pente à  Calamagrostide;;x;;;Y;Y;Y;Y;Y;Y;Y;Y;;;x;x;17;Eiben-Bu-Wald/Steilhang-Bu-Wald mit Reitgras;17;BUT;Buche trocken;Buchenwälder;17;;17;
18;18;Y;Festuco-Abieti-Fagetum;Waldschwingel-Tannen-Buchenwald;Waldschwingel-Ta-Bu-Wald;Hêtraie à  Sapin typique;;x;;;Y;Y;Y;Y;Y;Y;Y;Y;;;x;x;18;Waldschwingel-Ta-Bu-Wald;18 18M 19 20;TABUM;Tanne-Buche mittel;Tannen-Buchenwälder;18 18M 19 20;;18;Ohne anstehendem Fels
18.000003;18Fe   ;Y;"Festuco-Abieti-Fagetum; Ausbildung auf Fels";Waldschwingel-Tannen-Buchenwald auf Fels;Waldschwingel-Ta-Bu-Wald auf Fels;Hêtraie à  Sapin typique sur rochers;;;;;;;;;;;;;;;x;;18Fe;Waldschwingel-Ta-Bu-Wald auf Fels;18 18M 19 20;TABUM;Tanne-Buche mittel;Tannen-Buchenwälder;;;18;Mit anstehendem Fels
18.00007;18M    ;Y;Adenostyle glabrae-Abieti-Fagetum typicum;Typischer Karbonat-Tannen-Buchenwald;Typischer Karbonat-Ta-Bu-Wald;Hêtraie à  Sapin avec Adénostyle glabre;;x;;;Y;Y;Y;Y;Y;Y;Y;Y;;;x;x;18M;Typischer Karbonat-Ta-Bu-Wald;18 18M 19 20;TABUM;Tanne-Buche mittel;Tannen-Buchenwälder;18 18M 19 20;;18*;"Ohne Wechselfeuchtigkeitszeiger; ohne Trockenheitszeiger"
18.014;18w    ;Y;Adenostylo glabrae Abieti-Fagetum calamagrostietosum variae;Typischer Buntreitgras-Tannen-Buchenwald;Typischer Buntreitgras-Ta-Bu-Wald;Hêtraie à  Sapin avec Calamagrostide bigarrée;;x;;;Y;Y;Y;Y;Y;Y;Y;Y;;;x;x;18w;Typischer Buntreitgras-Ta-Bu-Wald;18v 18w;TABUM;Tanne-Buche mittel;Tannen-Buchenwälder;18v 18w;;18*;"Mit Wechselfeuchtigkeitszeigern; ohne Carex ferruginea"
18.015;18v    ;Y;"Adenostylo glabrae Abieti-Fagetum calamagrostietosum variae; Ausbildung mit Carex ferruginea";Buntreitgras-Tannen-Buchenwald mit Rostsegge;Buntreitgras-Ta-Bu-Wald mit Rostsegge;Hêtraie à  Sapin avec Calamagrostide bigarrée et Laiche ferrugineuse;;x;;;Y;Y;Y;Y;Y;Y;Y;Y;;;x;x;18v;Buntreitgras-Ta-Bu-Wald mit Rostsegge;18v 18w;TABUM;Tanne-Buche mittel;Tannen-Buchenwälder;18v 18w;;18*;"Mit Wechselfeuchtigkeitszeigern; mit Carex ferruginea"
18.1;18*    ;Y;Adenostyle glabrae-Abieti-Fagetum caricetosum albae;Karbonat-Tannen-Buchenwald mit Weissegge;Karbonat-Ta-Bu-Wald mit Weissegge;Hêtraie à  Sapin avec Laiche blanche;;x;;;Y;Y;Y;Y;Y;Y;Y;Y;;;x;x;18Stern;Karbonat-Ta-Bu-Wald mit Weissegge;18*;TABUM;Tanne-Buche mittel;Tannen-Buchenwälder;18*;;18*;Mit Trockenheitszeigern
19;19;Y;Luzulo-Abieti-Fagetum typicum;Typischer Waldsimsen-Tannen-Buchenwald;Typischer Waldsimsen-Ta-Bu-Wald;Hêtraie à  Sapin avec Luzule des forêts;;x;;;Y;Y;Y;Y;Y;Y;Y;Y;;;x;x;19;Typischer Waldsimsen-Ta-Bu-Wald;18 18M 19 20;TABUM;Tanne-Buche mittel;Tannen-Buchenwälder;18 18M 19 20;;19;"Ohne verdichteten Boden; ohne anstehendem Fels"
19.000003;19Fe   ;Y;"Luzulo-Abieti-Fagetum typicum; Ausbildung auf Fels";Typischer Waldsimsen-Tannen-Buchenwald auf Fels;Typischer Waldsimsen-Ta-Bu-Wald auf Fels;Hêtraie à  Sapin avec Luzule des forêts sur rochers;;;;;;;;;;;;;;;x;;19Fe;Typischer Waldsimsen-Ta-Bu-Wald auf Fels;18 18M 19 20;TABUM;Tanne-Buche mittel;Tannen-Buchenwälder;;;19;"Ohne verdichteten Boden; mit anstehendem Fels"
19.00006;19L    ;Y;Laburno-Abieti-Fagetum typicum;Typischer Goldregen-Tannen-Buchenwald;Typischer Goldregen-Ta-Bu-Wald;Hêtraie à  Sapin avec Aubours typique;;x;;;;;;;;;;;;;x;x;19L;Typischer Goldregen-Ta-Bu-Wald;19L;BUTA;Buche-Tanne;Tannen-Buchenwälder;19L;;19*;"Viel mittlere Arten; keine Basenzeiger; keine Feuchtigkeitszeiger"
19.0002;19LC   ;Y;Laburno-Abieti-Fagetum cardaminetosum kitaibelii;Goldregen-Tannen-Buchenwald mit Kitaibels Zahnwurz;Goldregen-Ta-Bu-Wald mit Kitaibels Zahnwurz;Hêtraie à  Sapin avec Aubours et Dentaire de Kitaibel;;;;;;;;;;;;;;;x;;19LC;Goldregen-Ta-Bu-Wald mit Kitaibels Zahnwurz;19LC;BUTA;Buche-Tanne;Tannen-Buchenwälder;;;19*;Viele mittlere Arten und Basenzeiger
19.00021;19LP   ;Y;Laburno-Abieti-Fagetum petasitetosum;Goldregen-Tannen-Buchenwald mit weisser Pestwurz;Goldregen-Ta-Bu-Wald mit weisser Pestwurz;Hêtraie à  Sapin avec Aubours et hautes herbes;;x 20*;;;Y;;;;Y;;Y;;;;x;x;19LP;Goldregen-Ta-Bu-Wald mit weisser Pestwurz;19LP;BUTA;Buche-Tanne ;Tannen-Buchenwälder;20*;;20*;Viele mittlere Arten und Feuchtigkeitszeiger
19.001;19a    ;Y;Luzulo-Abieti-Fagetum calamagrostietosum arundinaceae;Waldsimsen-Tannen-Buchenwald mit Rohrreitgras;Waldsimsen-Ta-Bu-Wald mit Rohrreitgras;Hêtraie à  Sapin avec Luzule des forêts et Calamagrostide des forêts;;;;x;Y;;Y;;Y;;Y;;;;x;x;19a;Waldsimsen-Ta-Bu-Wald mit Rohrreitgras;19a;BUTA;Buche-Tanne;Tannen-Buchenwälder;;"neues Anforderungsprofil: 1h mit Lärche und Föhre; sonstige Laubbäume (Winterlinde; Traubeneiche; Kastanie; Esche) 0 - 20 % ";19*;Wenig oder keine mittleren Arten
19.007;19f    ;Y;"Luzulo-Abieti-Fagetum; Ausbildung auf Pseudogley";Waldsimsen-Tannen-Buchenwald auf Pseudogley;Waldsimsen-Ta-Bu-Wald auf Pseudogley;Hêtraie à  Sapin avec Luzule des forêts sur pseudogley;;x;;;Y;Y;Y;Y;Y;Y;Y;Y;;;x;x;19f;Waldsimsen-Ta-Bu-Wald auf Pseudogley;19f 20E;TABUM;Tanne-Buche mittel;Tannen-Buchenwälder;19f 20E;;19;Mit verdichtetem Boden
20;20;Y;Adenostylo alliariae-Abieti-Fagetum typicum;Hochstauden-Tannen-Buchenwald;Hochstauden-Ta-Bu-Wald;Hêtraie à  Sapin avec hautes herbes;;x;;;Y;Y;Y;Y;Y;Y;Y;Y;;;x;x;20;Hochstauden-Ta-Bu-Wald;18 18M 19 20;TABUM;Tanne-Buche mittel;Tannen-Buchenwälder;18 18M 19 20;;20;"Ohne verdichteten Boden; ohne anstehendem  Fels"
20.000003;20Fe   ;Y;"Adenostylo alliariae-Abieti-Fagetum typicum; Ausbildung auf Fels";Hochstauden-Tannen-Buchenwald auf Fels;Hochstauden-Ta-Bu-Wald auf Fels;Hêtraie à  Sapin avec hautes herbes sur rochers;;;;;;;;;;;;;;;x;;20Fe;Hochstauden-Ta-Bu-Wald auf Fels;18 18M 19 20;TABUM;Tanne-Buche mittel;Tannen-Buchenwälder;;;20;"Ohne verdichteten Boden; mit anstehendem Fels"
20.00004;20E    ;Y;Adenostylo alliariae-Abieti-Fagetum hordelymetosum;Waldgersten-Tannen-Buchenwald;Waldgersten-Ta-Bu-Wald;Hêtraie à  Sapin avec Hordélyme d'Europe;;x;;;Y;Y;Y;Y;Y;Y;Y;Y;;;x;x;20E;Waldgersten-Ta-Bu-Wald;19f 20E;TABUM;Tanne-Buche mittel;Tannen-Buchenwälder;19f 20E;;20;Mit verdichtetem Boden
21;21;Y;Aceri-Fagetum;Ahorn-Buchenwald;Ahorn-Bu-Wald;Hêtraie à  Érable;;x;;;Y;Y;Y;Y;Y;Y;Y;Y;;;x;x;21;Ahorn-Bu-Wald;21;LHL;Laub hohe Lagen;Laubwälder hohe Lagen;21;;21;
21.00006;21L    ;Y;Laburno-Aceretum ;Goldregen-Ahornwald;Goldregen-Ahornwald;Erablaie à  Aubours;;;;x;Y;;Y;;Y;;Y;;;;x;;21L;Goldregen-Ahornwald;21L;LSE;Laub sonder extrem;Laubwälder Sonderwaldstandorte;;"neues Anforderungsprofil: Bergahorn und Laburnum 80 - 100 %; Bu. Ta; Esche; Fi 0 - 20 %";21**;
21.1;21*    ;Y;Alno viridi-Sorbetum aucupariae ;Grünerlen-Vogelbeerwald;Grünerlen-Vogelbeerwald;Forêt de Sorbiers à  Aune vert;;x;;;Y;;;;Y;;Y;;;;x;x;21Stern;Grünerlen-Vogelbeerwald;21*;LHL;Laub hohe Lagen;Laubwälder hohe Lagen;21*;;21* ;
22;22;Y;Phyllitido-Aceretum;Hirschzungen-Ahornwald;Hirschzungen-Ahornwald;Erablaie à  Langue-de-Cerf;;x;;;Y;Y;Y;Y;Y;Y;Y;Y;;;x;;22;Hirschzungen-Ahornwald;22 22A 22C 22*;LS;Laub sonder  ;Laubwälder Sonderwaldstandorte;22;;22;"Mit Blockschutt; Region J; M; 1; 2"
22.000003;22Fe   ;Y;"Phyllitido-Aceretum; Ausbildung auf Fels";Hirschzungen-Ahornwald auf Fels;Hirschzungen-Ahornwald auf Fels;Erablaie à  Langue-de-Cerf sur rochers;;;;;;;;;;;;;;;x;;22Fe;Hirschzungen-Ahornwald auf Fels;22 22A 22C 22*;LS;Laub sonder  ;Laubwälder Sonderwaldstandorte;;;22;"Mit anstehendem Fels; Region J; M; 1; 2"
22.00001;22A    ;Y;Arunco-Aceretum;Geissbart-Ahornwald;Geissbart-Ahornwald;Erablaie à  Reine-des-bois;;;x;;Y;Y;Y;Y;Y;Y;Y;Y;;;x;;22A;Geissbart-Ahornwald;22 22A 22C 22*;LS;Laub sonder  ;Laubwälder Sonderwaldstandorte;;Anforderungsprofil von 22;22**Arunco-Aceretum;
