25,001;25a;;;;Le tilleul à petites feuilles domine, accompagné du frêne et du châtaignier. ;25;30;30;35;;Region 5 Sonderwaldstandort, Region 4 Hauptwaldstandort. Taleinschnitte mit steilen Hängen. Silikat- und Moränen-Schutthalden mit Steinschlag, zwischen dem Schutt Hohlräume. Ausserhalb vom Buchenareal teilweise auch auf zonalen Hängen.;Dans la région 5, station forestière particulière, dans la région 4, station forestière principale. Vallées aux versants raides. Éboulis sur roches siliceuses et morainiques avec chutes de pierre, cavités entre les pierres. En dehors de l’aire du hêtre, par endroits également sur des versants à caractère zonal.;"Krautschicht aus mittleren Arten, Efeu bildet Rasen, Lücken mit viel Haselsträuchern.
";Strate herbacée composée d’espèces mésotrophe, tapis de lierre, trouées avec buissons de noisetiers abondants. ;Mull;"Kolluviale Böden, oberflächlich verbraunt, leicht sauer bis neutral.
";"Skelettgehalt mittel, Gründigkeit mittel. Durchlässig, keine Vernässung
";Pierrosité moyenne et profondeur moyennes. Perméable, non hydromorphe. ;2;0;2;;;1;2;1;1;0;0;1;2;1;1;0;1;2;1;1;0;2;2;2;2;0;0;25a;;;;;;;;;;2;StaoReg 4;2;StaoReg 5a, 5b;0;;0;0;0;0
25,001001;25as;;;;Le tilleul à petites feuilles domine, accompagné du châtaignier et du chêne sessile. ;20;25;30;28;;Region 5 Sonderwaldstandort, Region 4 Hauptwaldstandort. Austrockende, teilw. sonnige, felsige oder schuttige Hänge. Felsen. Ausserhalb vom Buchenareal teilweise auch auf zonalen Hängen.;Dans la région 5, station forestière particulière, dans la région 4, station forestière principale. Versants éboulés ou versants rocheux très secs et partiellement ensoleillés. Rochers. En dehors de l’aire du hêtre, par endroits également sur des versants à caractère zonal.;"Krautschicht lückig, oft mit Trockenzeigern.
";Strate herbacée lacunaire, souvent avec espèces indicatrices de sécheresse. ;Moder;"Regosol, kolluviale Ranker, wenig tief verbraunt.
";"Skelettgehalt mittel bis hoch, Gründigkeit flach bis tief. Durchlässig, keine Vernässung
";Pierrosité moyenne à élevée, sol superficiel à profond. Perméable, non hydromorphe. ;0;0;2;;;1;2;2;0;2;0;1;1;1;2;0;1;2;2;1;0;2;2;2;2;0;0;25as;;;;;;;;;;2;StaoReg 4;2;StaoReg 5a, 5b;0;;0;0;0;0
25,002;25b;;;;Forêt de feuillus mélangée de bonne croissance, souvent peuplement issu de taillis avec charme-houblon, tilleul à petites feuilles, tilleul à grandes feuilles, frêne, frêne à fleurs, érable, orme, merisier, hêtre, charme, châtaignier, chênes, houx, laurier noble et noyer.  ;20;30;32;30;;"Sonderwaldstandort. Frische Kalkschutthalden teilweise stabilisiert, feinschuttig, gelegentlich mit Steinschlag. 
";Station forestière particulière. Éboulis calcaires frais et partiellement stabilisés, fins, chutes de pierres occasionnelles. ;Region 5 Sonderwaldstandort, Region 4 Hauptwaldstandort. Spärliche Strauchschicht in den reifen Stadien, sonst dichte Haselbestände. Krautschicht mit Â«frischemÂ» Aussehen. Frischere Fazies mit Farnen.;Région 5 station forestière particulière, région 4 station forestière principale. Strate buissonnante clairsemée dans les stades évolués, sinon denses peuplements de noisetiers. Strate herbacée d’aspect « frais ». Variante plus fraîche avec fougères.;Kalkmull;"Rendzina, teilweise oberflächlich verbraunt, Pararendzina, (Regosol).
";"Skelettgerhalt sehr hoch, Gründigkeit sehr tief, durchlässig, keine Vernässung 
";Pierrosité très élevée, sol très profond, perméable, non hydromorphe. ;9;1;1;;;0;1;1;2;0;0;2;2;0;2;2;2;1;0;1;0;0;2;0;0;0;0;25b;;;;;;;;;;0;;1;;0;;0;0;0;0
25,005;25e;;;;Frênaie mélangée peu fertile, souvent buissonnante avec tilleuls et chênes isolés. ;10;20;22;20;;"Warme, trockene Kalkfelssteilhänge
";Versants abrupts chauds et secs sur calcaire. ;"Strauchig und krautig.
";Buissonnant et herbeux. ;Xeromull (Xero-Kalkmull) und Xero-Moder;"Sehr flachgründige Rendzina
";"Oft nur in Felsspalten, Durchlässigkeit übermässig
";Souvent uniquement dans les cavités rocheuses, perméabilité extrême. ;9;1;;;;0;1;1;0;2;0;1;1;1;2;2;0;0;0;1;0;0;2;0;0;0;2;25e;;;;;;;;;;1;;0;;0;;0;0;1;0
25,007;25f;;;;Le tilleul à petites feuilles et le frêne dominent, accompagnés du chêne sessile, du châtaignier, du hêtre, de l’érable sycomore, de l’orme de montagne, de l’aulne noir, de l’épicéa, du sapin et de l’if. Le peuplement peut évoluer vers une tillaie mélangée avec if, sapin, lierre et espèces laurophylles. ;25;30;32;30;;Sonderwaldstandort. Vegetationskomplex der schattigen Schluchten auf Silikat. Enge Täler mit  ozeanischem, luftfeuchten, windarmen Mesoklima. Bis 900 (1100) m über Meer.;Station forestière particulière. Formation végétale des gorges ombragées sur sol siliceux. Vallées étroites à mésoclimat océanique, à air humide et peu venteuses. Jusqu’à 900 (1100) m d’altitude.;"Artenreich, mit Säurezeigern, auf den Felswänden trockene Polster, auf bewegten Schutt Nährstoffzeiger wie Mondviole und viele Farne.
";Riche en espèces, avec espèces indicatrices d’acidité. Surfaces sèches sur les parois rocheuses, espèces indicatrices de bonnes conditions nutritives sur les éboulis instables comme la lunaire vivace et de nombreuses fougères. ;Mull;"Kolluviale Böden, teilweise verbraunt bis Ranker.
";"Skelettgehalt mittel bis hoch, Gründigkeit flach bis tief, keine Vernässung
";Pierrosité moyenne à élevée, sol superficiel à profond, non hydromorphe.  ;0;0;2;;;1;0;0;1;0;0;1;1;1;1;0;1;1;1;2;0;2;2;1;1;1;1;25f;;;;;;;;;;0;;1;;0;;0;0;2;0
25,017;25au;;;;Le tilleul à petites feuilles et le frêne dominent, accompagnés de l’érable sycomore (orme). ;25;35;37;35;;Region 5 Sonderwaldstandort, Region 4 Hauptwaldstandort. Frische Zufuhrlagen mit Schutt, steile Hänge, schattig und frisch.Ausserhalb vom Buchenareal teilweise auch auf zonalen Hängen.;Dans la région 5, station forestière particulière, dans la région 4, station forestière principale. Lieux frais alimentés en eau avec éboulis, versants raides, ombragés et frais. En dehors de l’aire du hêtre, par endroits également sur des versants à caractère zonal.;"Üppige Krautschicht mit Farnen und Brombeeren.
";Strate herbacée luxuriante avec fougères et ronces. ;Mull;"Kolluviale Böden bis saure Braunerde in den stabilisierten Teilen.
";"Skelettgehalt mittel bis sehr hoch, Gründigkeit flach bis tief, keine Vernässung
";Pierrosité moyenne à très élevée, sol superficiel à profond, non hydromorphe. ;2;0;2;;;1;2;1;1;0;0;1;2;2;1;0;1;2;1;1;0;1;2;1;1;2;2;25au;;;;;;;;;;2;StaoReg 4;2;StaoReg 5a, 5b;0;;0;0;0;0
25,1;25*;;;;Forêt de feuillus avec tilleul à grandes feuilles, tilleul à petites feuilles, frêne, érable sycomore, érable plane et alisier blanc. ;15;25;27;25;;"Sonderwaldstandort. Warm. Steile, trockene Kalkschutthalden mit Steinschlag und an der Oberfläche lose abgelagertem Schutt. 
";Station forestière particulière. Station chaude. Éboulis calcaires secs et raides avec chutes de pierres et dépôt d’éboulis meubles en surface.  ;"Oft dichte Strauchschicht, lückige, im Hochsommer oft austrocknende Krautschicht im Schutt.
";Strate buissonnante souvent dense, strate herbacée lacunaire, souvent sèche dans les éboulis. ;Kalkmull;"Pararendzina, Regosol, instabile Schutthalden
";"Skelettgehalt sehr hoch, Gründigkeit mittel bis tief, übermässig durchlässig, keine Vernässung
";Pierrosité très élevée, sol moyennement profond à profond, perméabilité extrême, non hydromorphe. ;9;1;;;;0;1;1;2;0;0;1;1;1;2;2;2;1;2;1;0;0;2;0;0;0;2;25Stern;;;;;;;;;;0;;1;;0;;0;0;0;0
26;26;;H;"Bergahorn und Esche dominieren, dazu Stieleiche, Kirschbaum (submontane Stufe), Bergulme, Tanne.
";L’érable sycomore et le frêne dominent, accompagnés du chêne pédonculé, du merisier (étage submontagnard), de l’orme de montagne et du sapin. ;25;35;40;40;;"Feuchte bis nasse, meist schattige Zufuhrlagen.
";Lieux humides à engorgés, alimentés en eau, généralement ombragés. ;"Oft üppige Hochstauden.
";Mégaphorbiées souvent luxuriantes. ;Mull (feuchte Ausprägung), stellenweise Kalkmull.;"Nassböden beeinflusst durch Grund-/Hangwasser oder Stauwasser, Braunerde, Pararbraunerde, Rendzina, Pararendzina, Regosol, vernässt. 
";"Skelettgehalt gering bis mittel, Gründigkeit sehr tief, biologische Aktivität hoch, obere Horizonte periodisch durchlüftet, untere Horizonte für Buche zu nass, Durchlässigkeit hoch bis gering, sehr stark bis schwach grundnass, Pseudogley bis schwach pseudovergleyt. 
";Pierrosité faible à moyenne, sol très profond, activité biologique intense, horizons supérieurs périodiquement aérés, horizons inférieurs trop engorgés pour le hêtre, perméabilité élevée à faible, très fortement à peu influencé par la nappe phréatique, pseudogley à peu pseudogleyifié. ;9;9;1;;150;2;1;2;1;0;0;2;0;0;0;0;0;0;2;0;0;1;2;2;2;0;0;26;;;;;;;;;;1;;0;;0;;0;0;0;0
26,000003;26Fe;26;U;"Bergahorn und Esche dominieren, dazu Stieleiche, Kirschbaum (submontane Stufe), Bergulme, Tanne.
";L’érable sycomore et le frêne dominent, accompagnés du chêne pédonculé, du merisier (étage submontagnard), de l’orme de montagne et du sapin. ;25;35;40;40;;"Feuchte bis nasse, meist schattige Zufuhrlagen mit anstehendem Fels.
";Lieux humides à engorgés, alimentés en eau, généralement ombragés, avec roches affleurantes.   ;"Oft üppige Hochstauden.
";Mégaphorbiées souvent luxuriantes. ;;;;;9;9;1;;150;2;1;2;1;0;0;2;1;0;0;2;0;0;2;0;0;1;2;2;2;0;0;26Fe;Y;Y;N;Y;N;Y;Y;Y;Y;1;;0;;0;;0;0;1;0
26,009;26h;;H;"Bergahorn und Esche dominieren, dazu Bergulme, Tanne, und Vogelbeere. Schlussgrad normal bis räumig. Einzelbäume und Kleinkollektive
";L’érable sycomore et le frêne dominent, accompagnés de l’orme de montagne, du sapin et du sorbier des oiseleurs. Degré de fermeture normal à espacé. Arbres isolés et petits collectifs. ;25;30;35;30;;"Tal- und Hangfusslagen
";Vallées et pieds de versants. ;"Üppige, artenreiche Krautschicht
";Strate herbacée luxuriante, riche en espèces. ;Mull, feuchte Ausprägung, stellenweise Kalkmull;"Nassböden beeinflusst durch Grund-/Hangwasser oder Stauwasser, Braunerde, Pararendzina, Regosol, vernässt. 
";"Skelettgehalt sehr gering bis hoch, Gründigkeit sehr tief, Durchlässigkeit mittel bis gering. sehr stark bis schwach grundnass, Pseudogley bis schwach pseudovergleyt.
";Pierrosité très faible à élevée, sol très profond, perméabilité moyenne à faible, influence de la nappe phréatique très forte à faible, pseudogley à peu pseudogleyifié. ;9;9;1;;60;2;1;2;1;0;0;2;0;0;0;0;0;0;2;0;2;1;2;2;2;0;0;26h;;;;;;;;;;1;;0;;0;;0;0;0;0
26,014;26w;;;;Peuplements d’aulnes blancs à érable de croissance moyenne et à couverture souvent discontinue, pouvant également être mélangés au frêne en dessous de 1200 m d’altitude. Strate buissonnante fortement couvrante constamment présente.;15;25;30;25;;"Stark wechselnde Feuchtigkeit. Stark basisch-tonige Unterlage, meist im Flyschgebiet, häufig sind Hangrutschungen und Wasseraustritte, gute bis übermässige Wasserversorgung mit periodischer Tendenz zur Austrocknung. Mässig geneigte Hänge, wasserzügige Mulden und konkave Hangfusslagen, steilere Tobelflanken mit Oberflächenerosion.
";Humidité fortement variable. Substrat fortement basique et argileux, généralement dans les terrains à flysch, glissements de terrain et écoulements d’eau fréquents, alimentation hydrique bonne à excessive avec une tendance périodique à l’assèchement. Pentes modérées, dépressions alimentées en eau courante et pieds de versants concaves, versants de ravins très raides à érosion superficielle. ;"Gut deckende Bodenvegetation mit ausgeprägtem Grasaspekt, zahlreiche, aber nicht üppig in Erscheinung tretende Krautpflanzen sind stets vorhanden aber nicht aspektbestimmend, die Moosschicht spielt eine untergeordnete Rolle 
";Végétation basse bien couvrante avec présence forte de graminées. De nombreuses herbes non luxuriantes sont toujours présentes, mais ne déterminent pas l’aspect. La strate muscinale joue un rôle mineur.   ;Mull, kaum organische Auflage;"Hangwasserbeeinflusste Rohböden
";"Stark tonig, wenig verwittert, basenreich bis zur Oberfläche, oft mit Stauhorizont, mässig skelettreich, schlecht durchlässig und gute bis übermässige Wasserspeicherkapazität, schlechte Durchlüftung 
";Sols fortement argileux, peu altérés, riches en bases jusqu’en surface, présentant souvent un horizon imperméable, pierrosité modérée, mauvaise perméablité et capacité de rétention bonne à extrême, mauvaise aération. ;2;1;;;;0;0;2;1;0;0;0;0;0;0;0;0;0;0;0;2;1;1;2;2;1;1;26w;;;;;;;;;;0;;0;;1;;0;0;0;0
27;27;;H;"Esche, Schwarzerle, vereinzelt Bergahorn.
";Frêne, aulne noir, quelques érables sycomores. ;25;30;30;33;;"Quellige Stellen und Bachläufe, Einfluss von fliessendem Wasser.
";"Zones de sources et cours d’eau ; influence de l’eau courante. ";"Oft üppige Krautschicht, an quelligen Stellen mit viel Riesenschachtelhalm.
";Strate herbacée souvent luxuriante, prêles géantes abondantes dans les zones de sources. ;Mull (feuchte Ausprägung), stellenweise Anmoor, Kalkmull;"Nassböden beeinflusst durch Grund-/Hangwasser oder Stauwasser, Braunerde, Rendzina, Pararendzina, Regosol, Ranker vernässt. 
";"Skelettgehalt sehr gering bis hoch, oft Kalktuff, Gründigkeit sehr tief,biologische Aktivität hoch. Durchlässigkeit hoch bis gering, sehr stark bis schach grundnass, stark bis sehr schwach pseudovergleyt
";Pierrosité très faible à élevée, souvent tuf calcaire, sol très profond, activité biologique intense, perméabilité élevée à faible, très fortement à peu influencé par la nappe phréatique, tendance au pseudogley forte à très faible. Perméabilité élevée à faible, très fortement à peu influencé par la nappe phréatique, tendance au pseudogley forte à très faible. ;0;0;9;0;;2;1;2;1;0;0;0;0;0;0;0;0;0;2;0;0;1;2;1;1;1;2;27;;;;;;;;;;1;;0;;0;;0;0;0;0
27,00017;27O;;;;Le frêne et l’aulne noir dominent. ;25;32;32;32;;"Quellige Stellen und kleine Bachläufe in wintermilden Lagen, Einfluss von fliessendem Wasser, Häufig am Hang auf Möräne und Silikat (kalkmeidend).
";Zones de sources et petits cours d’eau dans des stations au climat hivernal doux, influence de l’eau courante, souvent sur les versants de moraines et les pentes siliceuses (calcifuge). ;"Wüchsige Erlengruppen, mit Efeu. Unten Eschen und Brombeergestrüpp unterbrochen von Nassstellen. Farnhorste.
";Groupes d’aunes vigoureux, avec lierre. Sous les frênes et les ronciers, entrecoupé de zones humides. Touffes de fougères. ;Mull;"Braunerde teilw. mit Oxidation. Regosol oberflächlich verbraunt.
";"Skelettgehalt mittel bis hoch, Oben versauert, Gründigkeit tief, biologische Aktivität hoch. Durchlässigkeit mittel bis gross, Hang- und Grundwasserspiegel oberflächennah aber sauerstoffreich, daher nur schwach pseudovergleyt.
";Pierrosité moyenne à élevée, partie supérieure du sol acidifiée, sol profond, activité biologique intense. Perméabilité moyenne à élevée, nappe perchée et niveau de la nappe phréatique proches de la surface du sol, mais riches en oxygène, par conséquent le sol n’est que peu pseudogleyifié. ;0;0;2;;;1;0;2;1;0;0;2;2;0;0;0;2;0;1;2;0;2;2;2;1;1;1;27O;;;;;;;;;;1;;0;;0;;0;0;0;0
27,009;27h;;H;"Esche dominiert, dazu Bergahorn, einzelne Tannen und Weisserlen. Schlussgrad normal bis räumig. Einzelbäume und Kleinkollektive
";Le frêne domine, accompagné de l’érable sycomore, de quelques sapins et d’aulnes blancs Degré de fermeture normal à espacé. Arbres isolés et petits collectifs. ;20;25;30;25;;"Quellige und sickernasse Stellen oft entlang von Bachläufen. Untergrund kalkreich, verdichtet.
";Emplacements de sources et d’infiltrations souvent le long de cours d’eau. Sous-sol calcaire compacté. ;"Üppige, artenreiche Krautschicht, Riesenschachtelhalm, oft Tuffausscheidungen mit Kalkquellmoosen.
";Strate herbacée luxuriante, riche en espèces. Prêle géante, souvent cônes de tuf avec des mousses des sources calcaires. ;Mull, auch feuchte Ausprägung, tstellenweise Anmoor, Kalkmull;"Nassböden beeinflusst durch Grund-/Hangwasser oder Stauwasser, Braunerde, Rendzina, Pararendzina, Regosol vernässt.
";"Skelettgehalt sehr gering bis hoch, Gründigkeit sehr tief, Durchlässigkeit mittel bis gering, stark bis sehr schwach pseudovergleyt oder sehr stark bis schwach grundnass. 
";Pierrosité très faible à élevée, sol très profond, perméabilité moyenne à faible, tendance au pseudogley forte à très faible ou influence de la nappe phréatique très forte à faible. ;9;9;9;0;;2;1;2;1;0;0;0;0;0;0;0;0;0;2;0;0;1;2;1;1;1;2;27h;;;;;;;;;;1;;0;;0;;0;0;0;0
27,1;27*;;;;L’aulne blanc et l’érable sycomore dominent, accompagnés du sorbier des oiseleurs et de quelques sapins et épicéas dans les petites stations moins engorgées. Présence du frêne par endroits. Le degré de fermeture est espacé à clairiéré. Arbres isolés et petits collectifs. Petites troches. ;15;20;27;20;;"Stark tonhaltige und basenreiche Unterlage, oft Tonschiefer, Mergel oder Flysch, oft Standorte mit tiefgründigen Bodenrutschungen: meist in Mulden, oft entlang von wenig tief eingeschnittenen Bächen. Eher Schattenlage.
";"Substrat très argileux, riche en bases, souvent schistes argileux, marnes ou flysch ; souvent stations sur glissements de terrain profonds. En général, cuvettes, souvent le long de torrents peu encaissés. Lieux plutôt ombragés. ";"Sehr üppige, artenreiche Hochstaudenflur
";Mégaphorbiées très luxuriantes, riches en espèces. ;Mull, feuchte Ausprägung, stellenweise Moder, Kalkmull feuchte Ausprägungen, Anmoor, teils erodiert;"Nassböden beeinflusst durch Grund-/Hangwasser oder Stauwasser, Braunerde, Rendzina, Pararendzina, Regosol vernässt.
";"Skelettgehalt sehr gering bis hoch, Gründigkeit sehr tief, Durchlässigkeit mittel bis gering, stark bis sehr schwach pseudovergleyt oder sehr stark bis schwach grundnass. 
";Pierrosité très faible à élevée, sol très profond, perméabilité moyenne à faible, tendance au pseudogley forte à très faible ou influence de la nappe phréatique très forte à faible. ;9;1;;;;0;0;2;1;0;0;0;0;0;0;0;0;0;2;0;0;1;2;1;1;1;2;27Stern;;;;;;;;;;1;;0;;0;;0;0;0;0
28;28;;H;"Eschen-Mischwald mit Bergulme, Bergahorn und Stieleiche, Grauerle.
";Frênaie mélangée avec orme de montagne, érable sycomore, chêne pédonculé et aulne blanc. ;25;32;35;32;;"Auenwald im näheren Bereich des Flusslaufes, ursprünglich regelmässig (meist nicht alljährlich) überschwemmt, Grundwasser meist im Wurzelraum, in Trockenperioden absinkend. Bei Flusskorrekturen selten überdauernd
";Forêt alluviale à proximité d’un cours d’eau, à l’origine régulièrement (en général pas tous les ans) inondée, nappe généralement jusqu’à l’espace racinaire, abaissement du niveau de la nappe durant les périodes de sécheresse. Mise en péril en cas de corrections de cours d’eau. ;"Meist dominiert der Winter-Schachtelhalm, doch kann die Krautschicht artenreich sein. Sträucher weniger dicht als im Zweiblatt-Eschenmischwald
";Souvent dominé par la prêle d’hiver, mais la strate herbacée peut être riche en espèces. Arbustes moins denses que dans la Frênaie à Orme riveraine avec Listéra.;Mull, stellenweise feuchte Ausprägung, oft erodiert.;"Auenböden, Regosol, Pararendzina vernässt, Nassböden beeinflusst durch Grund-/Hangwasser. 
";"Oberboden sandig-lehmig, nährstoffreich, Unterboden kiesig, Skelettgehalt gering bis sehr hoch, Gründikeit mittel bis tief, durchlässig, sunpfig bis schwach grundnass.
";Partie superficielle du sol sablo-limoneuse, fertile, sous-sol intermédiaire graveleux, pierrosité faible à très élevée, sol moyennement profond à profond, perméable, tourbeux à peu influencé par la nappe phréatique. ;9;9;1;;0;2;1;0;0;0;1;0;0;0;0;0;0;0;2;0;0;0;1;1;2;2;2;28;;;;;;;;;;0;;0;;0;;1;0;0;0
29;29;;H;"Wüchsiger Eschenmischwald mit oft dominierender Esche und einzelnen Traubenkirschen, Bergahornen und Schwarzerlen. 
";Frênaie mélangée fertile, frêne fréquemment dominant avec, par pieds isolés, merisiers à grappes, érables sycomores et aulnes noirs. ;25;35;40;35;;"Flache Mulden und Plateaulagen mit Staunässe
";Cuvettes plates et plateaux avec eau stagnante. ;"Strauchig (oft Traubenkirsche) und krautig, Moose oft auch an Stammansatz
";Buissonnant (merisier à grappes fréquent) et herbeux, mousses fréquentes aussi sur les contreforts des troncs. ;Mull, stellenweise feuchte Ausprägung;"Nassböden beeinflusst durch Grund-/Hangwasser oder Stauwasser, Braunerde, Parabraunerde vernässt.
";"Skelettgehalt gering, Gründigkeit sehr tief, biologische Aktivität hoch, Durchlässigkeit mittel bis sehr gering, sehr stark bis schwach grundnass, Pseudogley bis schwach pseudovergleyt.
";Pierrosité faible, sol très profond, activité biologique intense, perméabilité moyenne à très faible, influence de la nappe phréatique très forte à faible, pseudogley à peu pseudogleyifié. ;9;9;1;60;;2;1;0;1;0;2;0;0;0;0;0;0;0;0;0;0;0;0;0;2;2;2;29;;;;;;;;;;1;;0;;0;;0;0;0;0
29,00001;29A;;H;"Eschen-Mischwald mit Bergulme, Bergahorn und Stieleiche, an erhöhten, lange nicht mehr überschwemmten Stellen kann sich die Buche ansiedeln. Heute oft ganz vom Fluss abgeschnitten, sodass die Entwicklung zum Buchenwald fortschreiten kann.
";Frênaie mélangée, avec orme de montagne, érable sycomore et chêne pédonculé. Possibilité pour le hêtre de s’implanter aux endroits surélevés qui ne sont plus inondés depuis longtemps. Emplacement souvent entièrement coupé du cours d’eau si bien que l’évolution vers une hêtraie peut se poursuivre.  ;28;35;40;35;;"Auenwald an Flüssen und grösseren Bächen, auch ursprünglich selten überschwemmt, Grundwasser meist im Wurzelraum, in Trockenperioden absinkend
";Forêt alluviale le long de cours d’eau et de grands ruisseaux, également à l’origine rarement inondée, nappe généralement jusqu’à l’espace racinaire, abaissement du niveau de ces dernières durant les périodes de sécheresse. ;"Sträucher oft dicht, Krautschicht kann sehr verschieden zusammengesetzt sein. 
";Buissons souvent denses, la composition de la strate herbacée peut être très diversifiée. ;Mull, stellenweise Kalkmull, teils erodiert.;"Auenböden, Nassböden beeinflusst durch Grund-/Hangwasser oder Stauwasser, Regosol, Pararendzina, Rendzina vernässt, verbraunt,
";"Boden sandig-lehmig, nährstoffreich, Skelettgehalt gering bis sehr hoch, Gründigkeit tief, Durchlässigkeit mittel bis hoch, schwach bis stark grundnass, pseudovergleyt bis schach pseudovergleyt.
";Sol sablo-limoneux, fertile, pierrosité faible à très élevée, sol profond, perméabilité moyenne à élevée, peu à fortement influencé par la nappe phréatique, pseudogleyifié à peu pseudogleyifié. ;9;9;1;;70;2;1;0;0;0;1;0;0;0;0;0;0;0;2;0;0;0;2;1;2;2;0;29A;;;;;;;;;;0;;0;;0;;1;0;0;0
29,00002;29C;;H;Eschen-Mischwald mit Bergahorn und Stieleiche, oft auch mit einzelnen Buchen. Die Lärche ist im Mittelland und Jura wenig geeignet, in den kontinentaler geprägten Gebieten (2a und angerenzend) gedeiht sie gut. Oft auch Übergänge zu Kalk-Buchenwäldern;Frênaie mélangée avec érable sycomore et chêne pédonculé. Également avec présence fréquente de quelques hêtres. Le mélèze est peu adapté au Plateau et au Jura, mais croît bien dans les régions marquées par un climat continental (2a et avoisinantes). Souvent, transition vers des hêtraies calcaires.;25;32;37;32;;Auenwald. Tiefere Lagen (unter 600 m ü. M.). Trockene Stellen der Aue, meist leicht erhöht und/oder mit sehr durchlässigem Untergrund, das Grundwasser erreicht nur die tieferen Bodenschichten;"Forêt alluviale. Station basse (en dessous de 600 m d’altitude). Endroits secs de la zone alluviale, en général légèrement surélevés et/ou avec un sous-sol très perméable ; les eaux souterraines n’atteignent que les couches inférieures du sol.";"Sträucher oft dicht, Krautschicht meist von der Weisssegge dominiert.
";Buissons souvent denses, strate herbacée souvent dominée par la laiche blanche. ;Mull, stellenweise Kalkmull, teils erodiert;"Auenböden. Regosol, Pararendzina, Rendzina vernässt, Nassböden beeinflusst durch Grund-/Hangwasser
";"Boden sandig-lehmig, Skelettgehalt sehr gering bis sehr hoch, Gründigkeit mittel bis tief, Durchlässigkeit hoch bis sehr hoch, grundnass bis keine Vernässung
";Sol sablo-limoneux, pierrosité très faible à très élevée, sol moyen à profond. ;9;1;1;;0;0;1;0;0;0;1;0;0;0;0;0;0;0;2;0;0;0;2;2;2;0;2;29C;;;;;;;;;;0;;0;;0;;1;0;0;0
29,009;29h;;H;"Wüchsiger Eschenmischwald, oft dominieren Esche und Tanne. 
";Frênaie mélangée fertile, frêne et sapin fréquemment dominants. ;30;35;40;30;;"Flache Mulden und Plateaulagen mit Staunässe
";Cuvettes plates et plateaux avec eau stagnante. ;"Krautig, moosig.
";Herbeux, mousses. ;Mull, Moder, stellenweise feuchte Ausprägung;"Nassböden beeinflusst durch Grund-/Hangwasser oder Stauwasser, Braunerde, Parabraunerde vernässt.
";"Skelettgehalt gering, Gründigkeit sehr tief, biologische Aktivität hoch, Durchlässigkeit mittel bis sehr gering, sehr stark bis schwach grundnass, Pseudogley bis schwach pseudovergleyt. 
";Pierrosité faible, sol très profond, activité biologique intense, perméabilité moyenne à très faible, influence de la nappe phréatique très forte à faible, pseudogley à peu pseudogleyifié. ;9;9;1;40;;2;1;0;1;0;1;0;0;0;0;0;0;0;0;0;0;0;0;0;2;2;2;29h;;;;;;;;;;1;;0;;0;;0;0;0;0
